2024-03-08 21:50:15.814900 - Ether / IP / UDP / DNS Qry "b'detectportal.firefox.com.'" 
2024-03-08 21:50:15.816495 - Ether / IP / UDP / DNS Qry "b'detectportal.firefox.com.'" 
2024-03-08 21:50:15.855609 - Ether / IP / UDP / DNS Ans "b'detectportal.prod.mozaws.net.'" 
2024-03-08 21:50:15.860243 - Ether / IP / UDP / DNS Ans "b'detectportal.prod.mozaws.net.'" 
2024-03-08 21:50:16.149689 - Ether / IP / UDP / DNS Qry "b'detectportal.firefox.com.'" 
2024-03-08 21:50:16.152680 - Ether / IP / UDP / DNS Ans "b'detectportal.prod.mozaws.net.'" 
2024-03-08 21:50:16.154364 - Ether / IP / UDP / DNS Qry "b'detectportal.firefox.com.'" 
2024-03-08 21:50:16.157820 - Ether / IP / UDP / DNS Ans "b'detectportal.prod.mozaws.net.'" 
2024-03-08 21:50:16.159502 - Ether / IP / TCP 172.24.99.60:44638 > 34.107.221.82:http S
2024-03-08 21:50:16.168083 - Ether / IP / TCP 34.107.221.82:http > 172.24.99.60:44638 SA
2024-03-08 21:50:16.169933 - Ether / IP / TCP 172.24.99.60:44638 > 34.107.221.82:http A
2024-03-08 21:50:16.171514 - Ether / IP / TCP 172.24.99.60:44638 > 34.107.221.82:http PA / Raw
2024-03-08 21:50:16.180454 - Ether / IP / TCP 34.107.221.82:http > 172.24.99.60:44638 A
2024-03-08 21:50:16.184181 - Ether / IP / TCP 34.107.221.82:http > 172.24.99.60:44638 PA / Raw
2024-03-08 21:50:16.186820 - Ether / IP / TCP 172.24.99.60:44638 > 34.107.221.82:http A
2024-03-08 21:50:16.248849 - Ether / IP / UDP / DNS Qry "b'example.org.'" 
2024-03-08 21:50:16.261447 - Ether / IP / UDP / DNS Qry "b'example.org.'" 
2024-03-08 21:50:16.264341 - Ether / IP / UDP / DNS Qry "b'ipv4only.arpa.'" 
2024-03-08 21:50:16.268230 - Ether / IP / UDP / DNS Qry "b'ipv4only.arpa.'" 
2024-03-08 21:50:16.271998 - Ether / IP / UDP / DNS Qry "b'detectportal.firefox.com.'" 
2024-03-08 21:50:16.273845 - Ether / IP / UDP / DNS Qry "b'detectportal.firefox.com.'" 
2024-03-08 21:50:16.277390 - Ether / IP / UDP / DNS Ans "b'detectportal.prod.mozaws.net.'" 
2024-03-08 21:50:16.280818 - Ether / IP / UDP / DNS Ans "b'detectportal.prod.mozaws.net.'" 
2024-03-08 21:50:16.282943 - Ether / IP / TCP 172.24.99.60:44646 > 34.107.221.82:http S
2024-03-08 21:50:16.286214 - Ether / IP / UDP / DNS Qry "b'detectportal.firefox.com.'" 
2024-03-08 21:50:16.289092 - Ether / IP / UDP / DNS Qry "b'detectportal.firefox.com.'" 
2024-03-08 21:50:16.292253 - Ether / IP / UDP / DNS Ans "b'detectportal.prod.mozaws.net.'" 
2024-03-08 21:50:16.295651 - Ether / IP / UDP / DNS Ans "b'detectportal.prod.mozaws.net.'" 
2024-03-08 21:50:16.297593 - Ether / IP / UDP / DNS Ans "93.184.216.34" 
2024-03-08 21:50:16.300299 - Ether / IP / TCP 34.107.221.82:http > 172.24.99.60:44646 SA
2024-03-08 21:50:16.303570 - Ether / IP / TCP 172.24.99.60:44646 > 34.107.221.82:http A
2024-03-08 21:50:16.306389 - Ether / IP / TCP 172.24.99.60:44646 > 34.107.221.82:http PA / Raw
2024-03-08 21:50:16.309732 - Ether / IP / UDP / DNS Ans "192.0.0.171" 
2024-03-08 21:50:16.316541 - Ether / IP / TCP 34.107.221.82:http > 172.24.99.60:44646 A
2024-03-08 21:50:16.319753 - Ether / IP / TCP 34.107.221.82:http > 172.24.99.60:44646 PA / Raw
2024-03-08 21:50:16.321572 - Ether / IP / TCP 172.24.99.60:44646 > 34.107.221.82:http A
2024-03-08 21:50:16.325054 - Ether / IP / UDP / DNS Ans 
2024-03-08 21:50:16.353388 - Ether / IP / UDP / DNS Qry "b'contile.services.mozilla.com.'" 
2024-03-08 21:50:16.355931 - Ether / IP / UDP / DNS Qry "b'contile.services.mozilla.com.'" 
2024-03-08 21:50:16.396213 - Ether / IP / UDP / DNS Ans "34.117.237.239" 
2024-03-08 21:50:16.398515 - Ether / IP / UDP / DNS Ans 
2024-03-08 21:50:16.399629 - Ether / IP / TCP 172.24.99.60:58076 > 34.117.237.239:https S
2024-03-08 21:50:16.410837 - Ether / IP / TCP 34.117.237.239:https > 172.24.99.60:58076 SA
2024-03-08 21:50:16.413213 - Ether / IP / TCP 172.24.99.60:58076 > 34.117.237.239:https A
2024-03-08 21:50:16.416009 - Ether / IP / TCP 172.24.99.60:58076 > 34.117.237.239:https PA / Raw
2024-03-08 21:50:16.427821 - Ether / IP / TCP 34.117.237.239:https > 172.24.99.60:58076 A
2024-03-08 21:50:16.431111 - Ether / IP / TCP 34.117.237.239:https > 172.24.99.60:58076 PA / Raw
2024-03-08 21:50:16.433052 - Ether / IP / TCP 172.24.99.60:58076 > 34.117.237.239:https A
2024-03-08 21:50:16.435992 - Ether / IP / TCP 34.117.237.239:https > 172.24.99.60:58076 PA / Raw
2024-03-08 21:50:16.438250 - Ether / IP / TCP 172.24.99.60:58076 > 34.117.237.239:https A
2024-03-08 21:50:16.482924 - Ether / IP / UDP / DNS Ans "2606:2800:220:1:248:1893:25c8:1946" 
2024-03-08 21:50:16.599117 - Ether / IP / UDP / DNS Qry "b'content-signature-2.cdn.mozilla.net.'" 
2024-03-08 21:50:16.601750 - Ether / IP / UDP / DNS Qry "b'content-signature-2.cdn.mozilla.net.'" 
2024-03-08 21:50:16.618826 - Ether / IP / UDP / DNS Qry "b'r3.o.lencr.org.'" 
2024-03-08 21:50:16.621156 - Ether / IP / UDP / DNS Qry "b'r3.o.lencr.org.'" 
2024-03-08 21:50:16.649710 - Ether / IP / UDP / DNS Ans "b'content-signature-chains.prod.autograph.services.mozaws.net.'" 
2024-03-08 21:50:16.653426 - Ether / IP / UDP / DNS Ans "b'content-signature-chains.prod.autograph.services.mozaws.net.'" 
2024-03-08 21:50:16.658758 - Ether / IP / TCP 172.24.99.60:39040 > 34.160.144.191:https S
2024-03-08 21:50:16.675929 - Ether / IP / TCP 34.160.144.191:https > 172.24.99.60:39040 SA
2024-03-08 21:50:16.677795 - Ether / IP / TCP 172.24.99.60:39040 > 34.160.144.191:https A
2024-03-08 21:50:16.680371 - Ether / IP / TCP 172.24.99.60:39040 > 34.160.144.191:https PA / Raw
2024-03-08 21:50:16.692394 - Ether / IP / UDP / DNS Ans "b'o.lencr.edgesuite.net.'" 
2024-03-08 21:50:16.695340 - Ether / IP / UDP / DNS Ans "b'o.lencr.edgesuite.net.'" 
2024-03-08 21:50:16.696858 - Ether / IP / TCP 34.160.144.191:https > 172.24.99.60:39040 A
2024-03-08 21:50:16.699196 - Ether / IP / TCP 34.160.144.191:https > 172.24.99.60:39040 A / Raw
2024-03-08 21:50:16.700816 - Ether / IP / TCP 172.24.99.60:39040 > 34.160.144.191:https A
2024-03-08 21:50:16.705213 - Ether / IP / TCP 34.160.144.191:https > 172.24.99.60:39040 PA / Raw
2024-03-08 21:50:16.707609 - Ether / IP / TCP 172.24.99.60:39040 > 34.160.144.191:https A
2024-03-08 21:50:16.710651 - Ether / IP / TCP 34.160.144.191:https > 172.24.99.60:39040 PA / Raw
2024-03-08 21:50:16.713164 - Ether / IP / TCP 172.24.99.60:39040 > 34.160.144.191:https A
2024-03-08 21:50:16.715364 - Ether / IP / TCP 172.24.99.60:39040 > 34.160.144.191:https PA / Raw
2024-03-08 21:50:16.718819 - Ether / IP / TCP 172.24.99.60:36576 > 118.98.77.121:http S
2024-03-08 21:50:16.722750 - Ether / IP / TCP 34.160.144.191:https > 172.24.99.60:39040 PA / Raw
2024-03-08 21:50:16.725104 - Ether / IP / TCP 34.160.144.191:https > 172.24.99.60:39040 PA / Raw
2024-03-08 21:50:16.765426 - Ether / IP / TCP 172.24.99.60:39040 > 34.160.144.191:https A
2024-03-08 21:50:16.767502 - Ether / IP / TCP 34.160.144.191:https > 172.24.99.60:39040 PA / Raw
2024-03-08 21:50:16.769397 - Ether / IP / TCP 172.24.99.60:39040 > 34.160.144.191:https A
2024-03-08 21:50:16.787450 - Ether / IP / UDP / DNS Qry "b'r3.o.lencr.org.'" 
2024-03-08 21:50:16.790662 - Ether / IP / UDP / DNS Ans "b'o.lencr.edgesuite.net.'" 
2024-03-08 21:50:16.792025 - Ether / IP / UDP / DNS Qry "b'r3.o.lencr.org.'" 
2024-03-08 21:50:16.794674 - Ether / IP / UDP / DNS Ans "b'o.lencr.edgesuite.net.'" 
2024-03-08 21:50:16.795919 - Ether / IP / TCP 172.24.99.60:36586 > 118.98.77.121:http S
2024-03-08 21:50:16.961842 - Ether / IP / UDP / DNS Qry "b'r3.o.lencr.org.'" 
2024-03-08 21:50:16.964477 - Ether / IP / UDP / DNS Ans "b'o.lencr.edgesuite.net.'" 
2024-03-08 21:50:16.966674 - Ether / IP / TCP 172.24.99.60:36592 > 118.98.77.121:http S
2024-03-08 21:50:17.043194 - Ether / IP / UDP / DNS Qry "b'r3.o.lencr.org.'" 
2024-03-08 21:50:17.045147 - Ether / IP / UDP / DNS Ans "b'o.lencr.edgesuite.net.'" 
2024-03-08 21:50:17.046968 - Ether / IP / TCP 172.24.99.60:36602 > 118.98.77.121:http S
2024-03-08 21:50:17.052437 - Ether / IP / TCP 118.98.77.121:http > 172.24.99.60:36602 SA
2024-03-08 21:50:17.053917 - Ether / IP / TCP 172.24.99.60:36602 > 118.98.77.121:http A
2024-03-08 21:50:17.054919 - Ether / IP / TCP 172.24.99.60:36602 > 118.98.77.121:http PA / Raw
2024-03-08 21:50:17.071222 - Ether / IP / TCP 118.98.77.121:http > 172.24.99.60:36602 A
2024-03-08 21:50:17.073092 - Ether / IP / TCP 118.98.77.121:http > 172.24.99.60:36602 PA / Raw
2024-03-08 21:50:17.074811 - Ether / IP / TCP 172.24.99.60:36602 > 118.98.77.121:http A
2024-03-08 21:50:17.076357 - Ether / IP / TCP 172.24.99.60:36602 > 118.98.77.121:http PA / Raw
2024-03-08 21:50:17.093380 - Ether / IP / TCP 118.98.77.121:http > 172.24.99.60:36602 A
2024-03-08 21:50:17.094454 - Ether / IP / TCP 118.98.77.121:http > 172.24.99.60:36602 PA / Raw
2024-03-08 21:50:17.137376 - Ether / IP / TCP 172.24.99.60:36602 > 118.98.77.121:http A
2024-03-08 21:50:17.196231 - Ether / IP / TCP 172.24.99.60:58076 > 34.117.237.239:https PA / Raw
2024-03-08 21:50:17.197449 - Ether / IP / TCP 172.24.99.60:58076 > 34.117.237.239:https PA / Raw
2024-03-08 21:50:17.198683 - Ether / IP / TCP 172.24.99.60:58076 > 34.117.237.239:https PA / Raw
2024-03-08 21:50:17.207921 - Ether / IP / TCP 34.117.237.239:https > 172.24.99.60:58076 PA / Raw
2024-03-08 21:50:17.209612 - Ether / IP / TCP 172.24.99.60:58076 > 34.117.237.239:https A
2024-03-08 21:50:17.211557 - Ether / IP / TCP 172.24.99.60:58076 > 34.117.237.239:https PA / Raw
2024-03-08 21:50:17.213552 - Ether / IP / TCP 34.117.237.239:https > 172.24.99.60:58076 A
2024-03-08 21:50:17.215876 - Ether / IP / TCP 34.117.237.239:https > 172.24.99.60:58076 PA / Raw
2024-03-08 21:50:17.219752 - Ether / IP / TCP 172.24.99.60:39040 > 34.160.144.191:https PA / Raw
2024-03-08 21:50:17.222469 - Ether / IP / TCP 172.24.99.60:39040 > 34.160.144.191:https PA / Raw
2024-03-08 21:50:17.225537 - Ether / IP / TCP 172.24.99.60:39040 > 34.160.144.191:https PA / Raw
2024-03-08 21:50:17.227270 - Ether / IP / TCP 34.117.237.239:https > 172.24.99.60:58076 A
2024-03-08 21:50:17.235125 - Ether / IP / TCP 34.160.144.191:https > 172.24.99.60:39040 A
2024-03-08 21:50:17.238004 - Ether / IP / TCP 34.160.144.191:https > 172.24.99.60:39040 PA / Raw
2024-03-08 21:50:17.239934 - Ether / IP / TCP 172.24.99.60:39040 > 34.160.144.191:https A
2024-03-08 21:50:17.242013 - Ether / IP / TCP 34.160.144.191:https > 172.24.99.60:39040 PA / Raw
2024-03-08 21:50:17.243129 - Ether / IP / TCP 172.24.99.60:39040 > 34.160.144.191:https A
2024-03-08 21:50:17.248116 - Ether / IP / TCP 34.160.144.191:https > 172.24.99.60:39040 PA / Raw
2024-03-08 21:50:17.250795 - Ether / IP / TCP 172.24.99.60:39040 > 34.160.144.191:https A
2024-03-08 21:50:17.252344 - Ether / IP / TCP 34.160.144.191:https > 172.24.99.60:39040 PA / Raw
2024-03-08 21:50:17.253714 - Ether / IP / TCP 172.24.99.60:39040 > 34.160.144.191:https A
2024-03-08 21:50:17.256385 - Ether / IP / TCP 34.160.144.191:https > 172.24.99.60:39040 A / Raw
2024-03-08 21:50:17.258183 - Ether / IP / TCP 172.24.99.60:39040 > 34.160.144.191:https A
2024-03-08 21:50:17.262014 - Ether / IP / TCP 34.160.144.191:https > 172.24.99.60:39040 PA / Raw
2024-03-08 21:50:17.265433 - Ether / IP / TCP 172.24.99.60:39040 > 34.160.144.191:https A
2024-03-08 21:50:17.267429 - Ether / IP / TCP 34.160.144.191:https > 172.24.99.60:39040 PA / Raw
2024-03-08 21:50:17.268994 - Ether / IP / TCP 172.24.99.60:39040 > 34.160.144.191:https A
2024-03-08 21:50:17.270819 - Ether / IP / TCP 172.24.99.60:39040 > 34.160.144.191:https PA / Raw
2024-03-08 21:50:17.272865 - Ether / IP / TCP 172.24.99.60:58076 > 34.117.237.239:https A
2024-03-08 21:50:17.276201 - Ether / IP / TCP 34.160.144.191:https > 172.24.99.60:39040 A
2024-03-08 21:50:17.382001 - Ether / IP / TCP 34.117.237.239:https > 172.24.99.60:58076 PA / Raw
2024-03-08 21:50:17.384379 - Ether / IP / TCP 172.24.99.60:58076 > 34.117.237.239:https A
2024-03-08 21:50:17.386193 - Ether / IP / TCP 172.24.99.60:58076 > 34.117.237.239:https PA / Raw
2024-03-08 21:50:17.391815 - Ether / IP / TCP 34.117.237.239:https > 172.24.99.60:58076 A
2024-03-08 21:50:17.393504 - Ether / IP / TCP 34.117.237.239:https > 172.24.99.60:58076 A
2024-03-08 21:50:17.607854 - Ether / IP / UDP / DNS Qry "b'push.services.mozilla.com.'" 
2024-03-08 21:50:17.609225 - Ether / IP / UDP / DNS Qry "b'push.services.mozilla.com.'" 
2024-03-08 21:50:17.651098 - Ether / IP / UDP / DNS Ans "b'autopush.prod.mozaws.net.'" 
2024-03-08 21:50:17.652491 - Ether / IP / UDP / DNS Ans "b'autopush.prod.mozaws.net.'" 
2024-03-08 21:50:17.654262 - Ether / IP / UDP / DNS Qry "b'autopush.prod.mozaws.net.'" 
2024-03-08 21:50:17.676743 - Ether / IP / UDP / DNS Qry "b'safebrowsing.googleapis.com.'" 
2024-03-08 21:50:17.677976 - Ether / IP / UDP / DNS Qry "b'safebrowsing.googleapis.com.'" 
2024-03-08 21:50:17.684961 - Ether / IP / UDP / DNS Ans 
2024-03-08 21:50:17.689210 - Ether / IP / UDP / DNS Qry "b'push.services.mozilla.com.'" 
2024-03-08 21:50:17.690705 - Ether / IP / UDP / DNS Qry "b'push.services.mozilla.com.'" 
2024-03-08 21:50:17.692226 - Ether / IP / UDP / DNS Ans "b'autopush.prod.mozaws.net.'" 
2024-03-08 21:50:17.693766 - Ether / IP / UDP / DNS Ans "b'autopush.prod.mozaws.net.'" 
2024-03-08 21:50:17.695160 - Ether / IP / UDP / DNS Qry "b'autopush.prod.mozaws.net.'" 
2024-03-08 21:50:17.700091 - Ether / IP / UDP / DNS Ans 
2024-03-08 21:50:17.701554 - Ether / IP / TCP 172.24.99.60:34608 > 34.107.243.93:https S
2024-03-08 21:50:17.714487 - Ether / IP / UDP / DNS Ans "64.233.170.95" 
2024-03-08 21:50:17.716336 - Ether / IP / UDP / DNS Ans "2404:6800:4003:c1a::5f" 
2024-03-08 21:50:17.717636 - Ether / IP / TCP 172.24.99.60:38034 > 64.233.170.95:https S
2024-03-08 21:50:17.734773 - Ether / IP / TCP 34.107.243.93:https > 172.24.99.60:34608 SA
2024-03-08 21:50:17.736612 - Ether / IP / TCP 172.24.99.60:34608 > 34.107.243.93:https A
2024-03-08 21:50:17.738712 - Ether / IP / TCP 172.24.99.60:36576 > 118.98.77.121:http S
2024-03-08 21:50:17.740399 - Ether / IP / TCP 172.24.99.60:34608 > 34.107.243.93:https PA / Raw
2024-03-08 21:50:17.746200 - Ether / IP / TCP 64.233.170.95:https > 172.24.99.60:38034 SA
2024-03-08 21:50:17.747539 - Ether / IP / TCP 172.24.99.60:38034 > 64.233.170.95:https A
2024-03-08 21:50:17.749669 - Ether / IP / TCP 172.24.99.60:38034 > 64.233.170.95:https PA / Raw
2024-03-08 21:50:17.758712 - Ether / IP / UDP / DNS Qry "b'incoming.telemetry.mozilla.org.'" 
2024-03-08 21:50:17.759970 - Ether / IP / UDP / DNS Qry "b'incoming.telemetry.mozilla.org.'" 
2024-03-08 21:50:17.771014 - Ether / IP / TCP 34.107.243.93:https > 172.24.99.60:34608 A
2024-03-08 21:50:17.773521 - Ether / IP / TCP 64.233.170.95:https > 172.24.99.60:38034 A
2024-03-08 21:50:17.784265 - Ether / IP / TCP 34.107.243.93:https > 172.24.99.60:34608 PA / Raw
2024-03-08 21:50:17.785919 - Ether / IP / TCP 172.24.99.60:34608 > 34.107.243.93:https A
2024-03-08 21:50:17.787131 - Ether / IP / TCP 34.107.243.93:https > 172.24.99.60:34608 PA / Raw
2024-03-08 21:50:17.788522 - Ether / IP / TCP 172.24.99.60:34608 > 34.107.243.93:https A
2024-03-08 21:50:17.789733 - Ether / IP / TCP 64.233.170.95:https > 172.24.99.60:38034 PA / Raw
2024-03-08 21:50:17.791040 - Ether / IP / TCP 172.24.99.60:38034 > 64.233.170.95:https A
2024-03-08 21:50:17.792577 - Ether / IP / TCP 64.233.170.95:https > 172.24.99.60:38034 PA / Raw
2024-03-08 21:50:17.795756 - Ether / IP / TCP 172.24.99.60:38034 > 64.233.170.95:https A
2024-03-08 21:50:17.797547 - Ether / IP / UDP / DNS Ans "b'telemetry-incoming.r53-2.services.mozilla.com.'" 
2024-03-08 21:50:17.799027 - Ether / IP / UDP / DNS Ans "b'telemetry-incoming.r53-2.services.mozilla.com.'" 
2024-03-08 21:50:17.800522 - Ether / IP / UDP / DNS Qry "b'telemetry-incoming.r53-2.services.mozilla.com.'" 
2024-03-08 21:50:17.802110 - Ether / IP / TCP 172.24.99.60:36586 > 118.98.77.121:http S
2024-03-08 21:50:17.854980 - Ether / IP / UDP / DNS Ans 
2024-03-08 21:50:17.856744 - Ether / IP / TCP 172.24.99.60:59222 > 34.120.208.123:https S
2024-03-08 21:50:17.864892 - Ether / IP / UDP / DNS Qry "b'r3.o.lencr.org.'" 
2024-03-08 21:50:17.866625 - Ether / IP / UDP / DNS Qry "b'r3.o.lencr.org.'" 
2024-03-08 21:50:17.868208 - Ether / IP / UDP / DNS Ans "b'o.lencr.edgesuite.net.'" 
2024-03-08 21:50:17.869990 - Ether / IP / UDP / DNS Ans "b'o.lencr.edgesuite.net.'" 
2024-03-08 21:50:17.871581 - Ether / IP / TCP 34.120.208.123:https > 172.24.99.60:59222 SA
2024-03-08 21:50:17.873139 - Ether / IP / TCP 172.24.99.60:59222 > 34.120.208.123:https A
2024-03-08 21:50:17.874875 - Ether / IP / TCP 172.24.99.60:59222 > 34.120.208.123:https PA / Raw
2024-03-08 21:50:17.877309 - Ether / IP / TCP 172.24.99.60:36602 > 118.98.77.121:http PA / Raw
2024-03-08 21:50:17.878840 - Ether / IP / UDP / DNS Qry "b'ocsp.pki.goog.'" 
2024-03-08 21:50:17.880507 - Ether / IP / UDP / DNS Qry "b'ocsp.pki.goog.'" 
2024-03-08 21:50:17.885480 - Ether / IP / TCP 34.120.208.123:https > 172.24.99.60:59222 A
2024-03-08 21:50:17.889763 - Ether / IP / TCP 34.120.208.123:https > 172.24.99.60:59222 A / Raw
2024-03-08 21:50:17.891221 - Ether / IP / TCP 172.24.99.60:59222 > 34.120.208.123:https A
2024-03-08 21:50:17.893132 - Ether / IP / TCP 34.120.208.123:https > 172.24.99.60:59222 PA / Raw
2024-03-08 21:50:17.894751 - Ether / IP / TCP 172.24.99.60:59222 > 34.120.208.123:https A
2024-03-08 21:50:17.896194 - Ether / IP / TCP 34.120.208.123:https > 172.24.99.60:59222 PA / Raw
2024-03-08 21:50:17.897492 - Ether / IP / TCP 172.24.99.60:59222 > 34.120.208.123:https A
2024-03-08 21:50:17.898775 - Ether / IP / TCP 118.98.77.121:http > 172.24.99.60:36602 A
2024-03-08 21:50:17.899895 - Ether / IP / TCP 118.98.77.121:http > 172.24.99.60:36602 PA / Raw
2024-03-08 21:50:17.901083 - Ether / IP / TCP 172.24.99.60:36602 > 118.98.77.121:http A
2024-03-08 21:50:17.917309 - Ether / IP / UDP / DNS Ans "b'pki-goog.l.google.com.'" 
2024-03-08 21:50:17.918609 - Ether / IP / UDP / DNS Ans "b'pki-goog.l.google.com.'" 
2024-03-08 21:50:17.920911 - Ether / IP / TCP 172.24.99.60:50170 > 64.233.170.94:http S
2024-03-08 21:50:17.939640 - Ether / IP / TCP 64.233.170.94:http > 172.24.99.60:50170 SA
2024-03-08 21:50:17.940963 - Ether / IP / TCP 172.24.99.60:50170 > 64.233.170.94:http A
2024-03-08 21:50:17.942357 - Ether / IP / TCP 172.24.99.60:50170 > 64.233.170.94:http PA / Raw
2024-03-08 21:50:17.945558 - Ether / IP / TCP 172.24.99.60:34608 > 34.107.243.93:https PA / Raw
2024-03-08 21:50:17.948185 - Ether / IP / TCP 172.24.99.60:34608 > 34.107.243.93:https PA / Raw
2024-03-08 21:50:17.955252 - Ether / IP / UDP / DNS Qry "b'ocsp.digicert.com.'" 
2024-03-08 21:50:17.959360 - Ether / IP / UDP / DNS Qry "b'ocsp.digicert.com.'" 
2024-03-08 21:50:17.963616 - Ether / IP / TCP 64.233.170.94:http > 172.24.99.60:50170 A
2024-03-08 21:50:17.965198 - Ether / IP / TCP 64.233.170.94:http > 172.24.99.60:50170 A
2024-03-08 21:50:17.966717 - Ether / IP / TCP 64.233.170.94:http > 172.24.99.60:50170 PA / Raw
2024-03-08 21:50:17.967876 - Ether / IP / TCP 172.24.99.60:50170 > 64.233.170.94:http A
2024-03-08 21:50:17.969716 - Ether / IP / TCP 34.107.243.93:https > 172.24.99.60:34608 PA / Raw
2024-03-08 21:50:17.971201 - Ether / IP / TCP 172.24.99.60:34608 > 34.107.243.93:https A
2024-03-08 21:50:17.972551 - Ether / IP / TCP 172.24.99.60:34608 > 34.107.243.93:https PA / Raw
2024-03-08 21:50:17.974069 - Ether / IP / TCP 34.107.243.93:https > 172.24.99.60:34608 PA / Raw
2024-03-08 21:50:17.975583 - Ether / IP / TCP 172.24.99.60:34612 > 34.107.243.93:https S
2024-03-08 21:50:17.977830 - Ether / IP / TCP 34.107.243.93:https > 172.24.99.60:34612 SA
2024-03-08 21:50:17.979595 - Ether / IP / TCP 172.24.99.60:34612 > 34.107.243.93:https A
2024-03-08 21:50:17.981609 - Ether / IP / TCP 172.24.99.60:34612 > 34.107.243.93:https PA / Raw
2024-03-08 21:50:17.991117 - Ether / IP / UDP / DNS Ans "b'ocsp.edge.digicert.com.'" 
2024-03-08 21:50:17.992991 - Ether / IP / UDP / DNS Ans "b'ocsp.edge.digicert.com.'" 
2024-03-08 21:50:17.994610 - Ether / IP / UDP / DNS Qry "b'fp2e7a.wpc.phicdn.net.'" 
2024-03-08 21:50:17.996185 - Ether / IP / TCP 34.107.243.93:https > 172.24.99.60:34612 A
2024-03-08 21:50:17.997797 - Ether / IP / TCP 172.24.99.60:36592 > 118.98.77.121:http S
2024-03-08 21:50:17.999394 - Ether / IP / TCP 34.107.243.93:https > 172.24.99.60:34612 PA / Raw
2024-03-08 21:50:18.001046 - Ether / IP / TCP 172.24.99.60:34612 > 34.107.243.93:https A
2024-03-08 21:50:18.002210 - Ether / IP / TCP 172.24.99.60:34612 > 34.107.243.93:https PA / Raw
2024-03-08 21:50:18.003282 - Ether / IP / TCP 34.107.243.93:https > 172.24.99.60:34608 A
2024-03-08 21:50:18.004645 - Ether / IP / TCP 172.24.99.60:34612 > 34.107.243.93:https PA / Raw
2024-03-08 21:50:18.013577 - Ether / IP / TCP 34.107.243.93:https > 172.24.99.60:34612 A
2024-03-08 21:50:18.015823 - Ether / IP / TCP 172.24.99.60:34608 > 34.107.243.93:https A
2024-03-08 21:50:18.022818 - Ether / IP / TCP 172.24.99.60:38034 > 64.233.170.95:https PA / Raw
2024-03-08 21:50:18.024179 - Ether / IP / TCP 172.24.99.60:38034 > 64.233.170.95:https PA / Raw
2024-03-08 21:50:18.025712 - Ether / IP / TCP 172.24.99.60:38034 > 64.233.170.95:https PA / Raw
2024-03-08 21:50:18.027325 - Ether / IP / UDP / DNS Ans 
2024-03-08 21:50:18.030169 - Ether / IP / TCP 172.24.99.60:50692 > 152.195.38.76:http S
2024-03-08 21:50:18.045145 - Ether / IP / TCP 64.233.170.95:https > 172.24.99.60:38034 PA / Raw
2024-03-08 21:50:18.046957 - Ether / IP / TCP 172.24.99.60:38034 > 64.233.170.95:https A
2024-03-08 21:50:18.048876 - Ether / IP / TCP 64.233.170.95:https > 172.24.99.60:38034 PA / Raw
2024-03-08 21:50:18.050339 - Ether / IP / TCP 172.24.99.60:38034 > 64.233.170.95:https A
2024-03-08 21:50:18.051715 - Ether / IP / TCP 172.24.99.60:38034 > 64.233.170.95:https PA / Raw
2024-03-08 21:50:18.053073 - Ether / IP / TCP 152.195.38.76:http > 172.24.99.60:50692 SA
2024-03-08 21:50:18.054386 - Ether / IP / TCP 172.24.99.60:50692 > 152.195.38.76:http A
2024-03-08 21:50:18.056715 - Ether / IP / TCP 172.24.99.60:50692 > 152.195.38.76:http PA / Raw
2024-03-08 21:50:18.058559 - Ether / IP / TCP 64.233.170.95:https > 172.24.99.60:38034 A
2024-03-08 21:50:18.060968 - Ether / IP / TCP 64.233.170.95:https > 172.24.99.60:38034 PA / Raw
2024-03-08 21:50:18.062229 - Ether / IP / TCP 64.233.170.95:https > 172.24.99.60:38034 PA / Raw
2024-03-08 21:50:18.063423 - Ether / IP / TCP 172.24.99.60:38034 > 64.233.170.95:https A
2024-03-08 21:50:18.064573 - Ether / IP / TCP 64.233.170.95:https > 172.24.99.60:38034 PA / Raw
2024-03-08 21:50:18.065871 - Ether / IP / TCP 64.233.170.95:https > 172.24.99.60:38034 PA / Raw
2024-03-08 21:50:18.067074 - Ether / IP / TCP 172.24.99.60:38034 > 64.233.170.95:https A
2024-03-08 21:50:18.068565 - Ether / IP / TCP 64.233.170.95:https > 172.24.99.60:38034 A / Raw
2024-03-08 21:50:18.070384 - Ether / IP / TCP 64.233.170.95:https > 172.24.99.60:38034 PA / Raw
2024-03-08 21:50:18.072300 - Ether / IP / TCP 172.24.99.60:38034 > 64.233.170.95:https A
2024-03-08 21:50:18.074022 - Ether / IP / TCP 64.233.170.95:https > 172.24.99.60:38034 A / Raw
2024-03-08 21:50:18.075378 - Ether / IP / TCP 64.233.170.95:https > 172.24.99.60:38034 PA / Raw
2024-03-08 21:50:18.077056 - Ether / IP / TCP 172.24.99.60:38034 > 64.233.170.95:https A
2024-03-08 21:50:18.078326 - Ether / IP / TCP 64.233.170.95:https > 172.24.99.60:38034 PA / Raw
2024-03-08 21:50:18.079877 - Ether / IP / TCP 172.24.99.60:38034 > 64.233.170.95:https PA / Raw
2024-03-08 21:50:18.081424 - Ether / IP / TCP 172.24.99.60:38034 > 64.233.170.95:https PA / Raw
2024-03-08 21:50:18.083127 - Ether / IP / TCP 172.24.99.60:38034 > 64.233.170.95:https FA
2024-03-08 21:50:18.085040 - Ether / IP / TCP 152.195.38.76:http > 172.24.99.60:50692 A
2024-03-08 21:50:18.086756 - Ether / IP / TCP 152.195.38.76:http > 172.24.99.60:50692 PA / Raw
2024-03-08 21:50:18.088175 - Ether / IP / TCP 172.24.99.60:50692 > 152.195.38.76:http A
2024-03-08 21:50:18.092804 - Ether / IP / TCP 64.233.170.95:https > 172.24.99.60:38034 A
2024-03-08 21:50:18.094238 - Ether / IP / TCP 64.233.170.95:https > 172.24.99.60:38034 A
2024-03-08 21:50:18.096138 - Ether / IP / TCP 64.233.170.95:https > 172.24.99.60:38034 A
2024-03-08 21:50:18.097764 - Ether / IP / TCP 64.233.170.95:https > 172.24.99.60:38034 A
2024-03-08 21:50:18.099078 - Ether / IP / TCP 64.233.170.95:https > 172.24.99.60:38034 FA
2024-03-08 21:50:18.100309 - Ether / IP / TCP 172.24.99.60:38034 > 64.233.170.95:https A
2024-03-08 21:50:18.110899 - Ether / IP / UDP / DNS Qry "b'firefox.settings.services.mozilla.com.'" 
2024-03-08 21:50:18.113397 - Ether / IP / UDP / DNS Qry "b'firefox.settings.services.mozilla.com.'" 
2024-03-08 21:50:18.136955 - Ether / IP / TCP 172.24.99.60:59222 > 34.120.208.123:https PA / Raw
2024-03-08 21:50:18.138340 - Ether / IP / TCP 172.24.99.60:59222 > 34.120.208.123:https PA / Raw
2024-03-08 21:50:18.141353 - Ether / IP / TCP 172.24.99.60:59222 > 34.120.208.123:https PA / Raw
2024-03-08 21:50:18.145448 - Ether / IP / TCP 172.24.99.60:59222 > 34.120.208.123:https PA / Raw
2024-03-08 21:50:18.148314 - Ether / IP / UDP / DNS Ans "b'prod.remote-settings.prod.webservices.mozgcp.net.'" 
2024-03-08 21:50:18.150272 - Ether / IP / UDP / DNS Qry "b'prod.remote-settings.prod.webservices.mozgcp.net.'" 
2024-03-08 21:50:18.152409 - Ether / IP / UDP / DNS Ans "b'prod.remote-settings.prod.webservices.mozgcp.net.'" 
2024-03-08 21:50:18.153675 - Ether / IP / TCP 34.120.208.123:https > 172.24.99.60:59222 PA / Raw
2024-03-08 21:50:18.154847 - Ether / IP / TCP 172.24.99.60:59222 > 34.120.208.123:https A
2024-03-08 21:50:18.156891 - Ether / IP / TCP 34.120.208.123:https > 172.24.99.60:59222 A
2024-03-08 21:50:18.159545 - Ether / IP / TCP 34.120.208.123:https > 172.24.99.60:59222 PA / Raw
2024-03-08 21:50:18.164972 - Ether / IP / TCP 172.24.99.60:59222 > 34.120.208.123:https A
2024-03-08 21:50:18.167083 - Ether / IP / TCP 172.24.99.60:59222 > 34.120.208.123:https PA / Raw
2024-03-08 21:50:18.168314 - Ether / IP / TCP 34.120.208.123:https > 172.24.99.60:59222 A
2024-03-08 21:50:18.180638 - Ether / IP / UDP / DNS Ans 
2024-03-08 21:50:18.195146 - Ether / IP / TCP 34.107.243.93:https > 172.24.99.60:34612 PA / Raw
2024-03-08 21:50:18.237373 - Ether / IP / TCP 172.24.99.60:34612 > 34.107.243.93:https A
2024-03-08 21:50:18.276074 - Ether / IP / TCP 172.24.99.60:57436 > 34.149.100.209:https S
2024-03-08 21:50:18.287612 - Ether / IP / TCP 34.149.100.209:https > 172.24.99.60:57436 SA
2024-03-08 21:50:18.289360 - Ether / IP / TCP 172.24.99.60:57436 > 34.149.100.209:https A
2024-03-08 21:50:18.290905 - Ether / IP / TCP 172.24.99.60:57436 > 34.149.100.209:https PA / Raw
2024-03-08 21:50:18.302585 - Ether / IP / TCP 34.149.100.209:https > 172.24.99.60:57436 A
2024-03-08 21:50:18.306803 - Ether / IP / TCP 34.149.100.209:https > 172.24.99.60:57436 PA / Raw
2024-03-08 21:50:18.308308 - Ether / IP / TCP 172.24.99.60:57436 > 34.149.100.209:https A
2024-03-08 21:50:18.310248 - Ether / IP / TCP 34.149.100.209:https > 172.24.99.60:57436 PA / Raw
2024-03-08 21:50:18.311859 - Ether / IP / TCP 172.24.99.60:57436 > 34.149.100.209:https A
2024-03-08 21:50:18.318627 - Ether / IP / TCP 172.24.99.60:34612 > 34.107.243.93:https PA / Raw
2024-03-08 21:50:18.320546 - Ether / IP / TCP 172.24.99.60:36602 > 118.98.77.121:http PA / Raw
2024-03-08 21:50:18.321849 - Ether / IP / UDP / DNS Qry "b'r3.o.lencr.org.'" 
2024-03-08 21:50:18.323748 - Ether / IP / UDP / DNS Qry "b'r3.o.lencr.org.'" 
2024-03-08 21:50:18.325508 - Ether / IP / UDP / DNS Ans "b'o.lencr.edgesuite.net.'" 
2024-03-08 21:50:18.327045 - Ether / IP / UDP / DNS Ans "b'o.lencr.edgesuite.net.'" 
2024-03-08 21:50:18.330784 - Ether / IP / TCP 118.98.77.121:http > 172.24.99.60:36602 A
2024-03-08 21:50:18.334533 - Ether / IP / TCP 118.98.77.121:http > 172.24.99.60:36602 PA / Raw
2024-03-08 21:50:18.336150 - Ether / IP / TCP 172.24.99.60:36602 > 118.98.77.121:http A
2024-03-08 21:50:18.337772 - Ether / IP / TCP 34.107.243.93:https > 172.24.99.60:34612 A
2024-03-08 21:50:18.342996 - Ether / IP / TCP 172.24.99.60:57436 > 34.149.100.209:https PA / Raw
2024-03-08 21:50:18.344530 - Ether / IP / TCP 172.24.99.60:57436 > 34.149.100.209:https PA / Raw
2024-03-08 21:50:18.354551 - Ether / IP / TCP 34.149.100.209:https > 172.24.99.60:57436 PA / Raw
2024-03-08 21:50:18.356312 - Ether / IP / TCP 172.24.99.60:57436 > 34.149.100.209:https PA / Raw
2024-03-08 21:50:18.357739 - Ether / IP / TCP 34.149.100.209:https > 172.24.99.60:57436 PA / Raw
2024-03-08 21:50:18.373118 - Ether / IP / TCP 34.149.100.209:https > 172.24.99.60:57436 A
2024-03-08 21:50:18.388327 - Ether / IP / TCP 34.120.208.123:https > 172.24.99.60:59222 PA / Raw
2024-03-08 21:50:18.390230 - Ether / IP / TCP 34.120.208.123:https > 172.24.99.60:59222 PA / Raw
2024-03-08 21:50:18.392229 - Ether / IP / TCP 34.120.208.123:https > 172.24.99.60:59222 PA / Raw
2024-03-08 21:50:18.393639 - Ether / IP / TCP 172.24.99.60:59222 > 34.120.208.123:https A
2024-03-08 21:50:18.396004 - Ether / IP / TCP 172.24.99.60:59222 > 34.120.208.123:https PA / Raw
2024-03-08 21:50:18.397843 - Ether / IP / TCP 172.24.99.60:57436 > 34.149.100.209:https A
2024-03-08 21:50:18.412305 - Ether / IP / TCP 34.120.208.123:https > 172.24.99.60:59222 A
2024-03-08 21:50:18.443656 - Ether / IP / UDP / DNS Qry "b'incoming.telemetry.mozilla.org.'" 
2024-03-08 21:50:18.445409 - Ether / IP / UDP / DNS Qry "b'incoming.telemetry.mozilla.org.'" 
2024-03-08 21:50:18.447352 - Ether / IP / UDP / DNS Ans "b'telemetry-incoming.r53-2.services.mozilla.com.'" 
2024-03-08 21:50:18.449141 - Ether / IP / UDP / DNS Ans "b'telemetry-incoming.r53-2.services.mozilla.com.'" 
2024-03-08 21:50:18.450625 - Ether / IP / UDP / DNS Qry "b'telemetry-incoming.r53-2.services.mozilla.com.'" 
2024-03-08 21:50:18.459587 - Ether / IP / UDP / DNS Ans 
2024-03-08 21:50:18.462939 - Ether / IP / TCP 172.24.99.60:59222 > 34.120.208.123:https PA / Raw
2024-03-08 21:50:18.464204 - Ether / IP / TCP 172.24.99.60:59222 > 34.120.208.123:https PA / Raw
2024-03-08 21:50:18.477697 - Ether / IP / TCP 34.120.208.123:https > 172.24.99.60:59222 A
2024-03-08 21:50:18.479098 - Ether / IP / TCP 34.120.208.123:https > 172.24.99.60:59222 A
2024-03-08 21:50:18.502098 - Ether / IP / TCP 34.107.243.93:https > 172.24.99.60:34612 PA / Raw
2024-03-08 21:50:18.503671 - Ether / IP / TCP 172.24.99.60:34612 > 34.107.243.93:https A
2024-03-08 21:50:18.543851 - Ether / IP / UDP / DNS Qry "b'incoming.telemetry.mozilla.org.'" 
2024-03-08 21:50:18.545817 - Ether / IP / UDP / DNS Qry "b'incoming.telemetry.mozilla.org.'" 
2024-03-08 21:50:18.547518 - Ether / IP / UDP / DNS Ans "b'telemetry-incoming.r53-2.services.mozilla.com.'" 
2024-03-08 21:50:18.549022 - Ether / IP / UDP / DNS Ans "b'telemetry-incoming.r53-2.services.mozilla.com.'" 
2024-03-08 21:50:18.550485 - Ether / IP / UDP / DNS Qry "b'telemetry-incoming.r53-2.services.mozilla.com.'" 
2024-03-08 21:50:18.553244 - Ether / IP / UDP / DNS Ans 
2024-03-08 21:50:18.554850 - Ether / IP / TCP 172.24.99.60:59222 > 34.120.208.123:https PA / Raw
2024-03-08 21:50:18.556532 - Ether / IP / TCP 172.24.99.60:59222 > 34.120.208.123:https PA / Raw
2024-03-08 21:50:18.557899 - Ether / IP / TCP 172.24.99.60:59236 > 34.120.208.123:https S
2024-03-08 21:50:18.569278 - Ether / IP / TCP 34.120.208.123:https > 172.24.99.60:59222 A
2024-03-08 21:50:18.570864 - Ether / IP / TCP 34.120.208.123:https > 172.24.99.60:59222 A
2024-03-08 21:50:18.573769 - Ether / IP / TCP 34.120.208.123:https > 172.24.99.60:59236 SA
2024-03-08 21:50:18.575723 - Ether / IP / TCP 172.24.99.60:59236 > 34.120.208.123:https A
2024-03-08 21:50:18.577080 - Ether / IP / TCP 172.24.99.60:59236 > 34.120.208.123:https PA / Raw
2024-03-08 21:50:18.578479 - Ether / IP / UDP / DNS Qry "b'incoming.telemetry.mozilla.org.'" 
2024-03-08 21:50:18.580648 - Ether / IP / UDP / DNS Ans "b'telemetry-incoming.r53-2.services.mozilla.com.'" 
2024-03-08 21:50:18.582080 - Ether / IP / UDP / DNS Qry "b'incoming.telemetry.mozilla.org.'" 
2024-03-08 21:50:18.584028 - Ether / IP / UDP / DNS Ans "b'telemetry-incoming.r53-2.services.mozilla.com.'" 
2024-03-08 21:50:18.585523 - Ether / IP / UDP / DNS Qry "b'telemetry-incoming.r53-2.services.mozilla.com.'" 
2024-03-08 21:50:18.587245 - Ether / IP / TCP 172.24.99.60:59222 > 34.120.208.123:https PA / Raw
2024-03-08 21:50:18.589568 - Ether / IP / TCP 172.24.99.60:59222 > 34.120.208.123:https PA / Raw
2024-03-08 21:50:18.591107 - Ether / IP / UDP / DNS Ans 
2024-03-08 21:50:18.592731 - Ether / IP / TCP 34.120.208.123:https > 172.24.99.60:59236 A
2024-03-08 21:50:18.593987 - Ether / IP / TCP 34.120.208.123:https > 172.24.99.60:59236 PA / Raw
2024-03-08 21:50:18.595128 - Ether / IP / TCP 172.24.99.60:59236 > 34.120.208.123:https A
2024-03-08 21:50:18.597099 - Ether / IP / TCP 34.120.208.123:https > 172.24.99.60:59236 PA / Raw
2024-03-08 21:50:18.598533 - Ether / IP / TCP 172.24.99.60:59236 > 34.120.208.123:https A
2024-03-08 21:50:18.600130 - Ether / IP / TCP 172.24.99.60:59236 > 34.120.208.123:https PA / Raw
2024-03-08 21:50:18.601369 - Ether / IP / TCP 34.120.208.123:https > 172.24.99.60:59222 A
2024-03-08 21:50:18.604831 - Ether / IP / TCP 34.120.208.123:https > 172.24.99.60:59222 A
2024-03-08 21:50:18.606847 - Ether / IP / TCP 34.120.208.123:https > 172.24.99.60:59236 PA / Raw
2024-03-08 21:50:18.608226 - Ether / IP / TCP 34.120.208.123:https > 172.24.99.60:59236 PA / Raw
2024-03-08 21:50:18.610504 - Ether / IP / TCP 172.24.99.60:59236 > 34.120.208.123:https PA / Raw
2024-03-08 21:50:18.612479 - Ether / IP / TCP 172.24.99.60:59236 > 34.120.208.123:https PA / Raw
2024-03-08 21:50:18.614297 - Ether / IP / TCP 172.24.99.60:59236 > 34.120.208.123:https FA
2024-03-08 21:50:18.622650 - Ether / IP / TCP 34.120.208.123:https > 172.24.99.60:59236 A
2024-03-08 21:50:18.624155 - Ether / IP / TCP 34.120.208.123:https > 172.24.99.60:59236 PA / Raw
2024-03-08 21:50:18.625897 - Ether / IP / TCP 172.24.99.60:59236 > 34.120.208.123:https R
2024-03-08 21:50:18.627193 - Ether / IP / TCP 34.120.208.123:https > 172.24.99.60:59236 A
2024-03-08 21:50:18.628836 - Ether / IP / TCP 172.24.99.60:59236 > 34.120.208.123:https R
2024-03-08 21:50:18.630199 - Ether / IP / TCP 34.120.208.123:https > 172.24.99.60:59236 FA
2024-03-08 21:50:18.631781 - Ether / IP / TCP 172.24.99.60:59236 > 34.120.208.123:https R
2024-03-08 21:50:18.716246 - Ether / IP / TCP 34.120.208.123:https > 172.24.99.60:59222 PA / Raw
2024-03-08 21:50:18.717748 - Ether / IP / TCP 34.120.208.123:https > 172.24.99.60:59222 PA / Raw
2024-03-08 21:50:18.719262 - Ether / IP / TCP 34.120.208.123:https > 172.24.99.60:59222 PA / Raw
2024-03-08 21:50:18.721074 - Ether / IP / TCP 172.24.99.60:59222 > 34.120.208.123:https A
2024-03-08 21:50:18.722094 - Ether / IP / TCP 172.24.99.60:59222 > 34.120.208.123:https PA / Raw
2024-03-08 21:50:18.734131 - Ether / IP / TCP 34.120.208.123:https > 172.24.99.60:59222 A
2024-03-08 21:50:18.744069 - Ether / IP / UDP / DNS Qry "b'incoming.telemetry.mozilla.org.'" 
2024-03-08 21:50:18.745565 - Ether / IP / UDP / DNS Qry "b'incoming.telemetry.mozilla.org.'" 
2024-03-08 21:50:18.747619 - Ether / IP / UDP / DNS Ans "b'telemetry-incoming.r53-2.services.mozilla.com.'" 
2024-03-08 21:50:18.749721 - Ether / IP / UDP / DNS Ans "b'telemetry-incoming.r53-2.services.mozilla.com.'" 
2024-03-08 21:50:18.751251 - Ether / IP / UDP / DNS Qry "b'telemetry-incoming.r53-2.services.mozilla.com.'" 
2024-03-08 21:50:18.753297 - Ether / IP / TCP 172.24.99.60:59222 > 34.120.208.123:https PA / Raw
2024-03-08 21:50:18.755032 - Ether / IP / TCP 172.24.99.60:59222 > 34.120.208.123:https PA / Raw
2024-03-08 21:50:18.756329 - Ether / IP / UDP / DNS Ans 
2024-03-08 21:50:18.761557 - Ether / IP / TCP 172.24.99.60:36576 > 118.98.77.121:http S
2024-03-08 21:50:18.762661 - Ether / IP / TCP 34.120.208.123:https > 172.24.99.60:59222 A
2024-03-08 21:50:18.764401 - Ether / IP / TCP 34.120.208.123:https > 172.24.99.60:59222 A
2024-03-08 21:50:18.816165 - Ether / IP / TCP 34.120.208.123:https > 172.24.99.60:59222 PA / Raw
2024-03-08 21:50:18.819777 - Ether / IP / TCP 34.120.208.123:https > 172.24.99.60:59222 PA / Raw
2024-03-08 21:50:18.821074 - Ether / IP / TCP 34.120.208.123:https > 172.24.99.60:59222 PA / Raw
2024-03-08 21:50:18.822857 - Ether / IP / TCP 172.24.99.60:59222 > 34.120.208.123:https A
2024-03-08 21:50:18.824435 - Ether / IP / TCP 172.24.99.60:59222 > 34.120.208.123:https PA / Raw
2024-03-08 21:50:18.825617 - Ether / IP / TCP 34.120.208.123:https > 172.24.99.60:59222 PA / Raw
2024-03-08 21:50:18.827025 - Ether / IP / TCP 34.120.208.123:https > 172.24.99.60:59222 PA / Raw
2024-03-08 21:50:18.828569 - Ether / IP / TCP 172.24.99.60:59222 > 34.120.208.123:https A
2024-03-08 21:50:18.829982 - Ether / IP / TCP 172.24.99.60:36586 > 118.98.77.121:http S
2024-03-08 21:50:18.832465 - Ether / IP / TCP 34.120.208.123:https > 172.24.99.60:59222 A
2024-03-08 21:50:19.017604 - Ether / IP / TCP 172.24.99.60:36592 > 118.98.77.121:http S
2024-03-08 21:50:19.028532 - Ether / IP / UDP / DNS Qry "b'www.google.com.'" 
2024-03-08 21:50:19.030219 - Ether / IP / UDP / DNS Qry "b'www.google.com.'" 
2024-03-08 21:50:19.035653 - Ether / IP / TCP 34.120.208.123:https > 172.24.99.60:59222 PA / Raw
2024-03-08 21:50:19.038269 - Ether / IP / TCP 34.120.208.123:https > 172.24.99.60:59222 PA / Raw
2024-03-08 21:50:19.039553 - Ether / IP / TCP 34.120.208.123:https > 172.24.99.60:59222 PA / Raw
2024-03-08 21:50:19.040864 - Ether / IP / TCP 172.24.99.60:59222 > 34.120.208.123:https A
2024-03-08 21:50:19.042182 - Ether / IP / TCP 172.24.99.60:59222 > 34.120.208.123:https PA / Raw
2024-03-08 21:50:19.050037 - Ether / IP / TCP 34.120.208.123:https > 172.24.99.60:59222 A
2024-03-08 21:50:19.057109 - Ether / IP / UDP / DNS Qry "b'incoming.telemetry.mozilla.org.'" 
2024-03-08 21:50:19.058864 - Ether / IP / UDP / DNS Qry "b'incoming.telemetry.mozilla.org.'" 
2024-03-08 21:50:19.060415 - Ether / IP / UDP / DNS Ans "b'telemetry-incoming.r53-2.services.mozilla.com.'" 
2024-03-08 21:50:19.062309 - Ether / IP / UDP / DNS Ans "b'telemetry-incoming.r53-2.services.mozilla.com.'" 
2024-03-08 21:50:19.064009 - Ether / IP / UDP / DNS Qry "b'telemetry-incoming.r53-2.services.mozilla.com.'" 
2024-03-08 21:50:19.066402 - Ether / IP / UDP / DNS Ans "142.251.12.103" 
2024-03-08 21:50:19.067862 - Ether / IP / TCP 172.24.99.60:59222 > 34.120.208.123:https PA / Raw
2024-03-08 21:50:19.069518 - Ether / IP / UDP / DNS Ans 
2024-03-08 21:50:19.070972 - Ether / IP / TCP 172.24.99.60:59222 > 34.120.208.123:https PA / Raw
2024-03-08 21:50:19.072510 - Ether / IP / TCP 34.120.208.123:https > 172.24.99.60:59222 A
2024-03-08 21:50:19.092123 - Ether / IP / TCP 34.120.208.123:https > 172.24.99.60:59222 A
2024-03-08 21:50:19.094581 - Ether / IP / UDP / DNS Ans "2404:6800:4003:c11::69" 
2024-03-08 21:50:19.096045 - Ether / IP / TCP 172.24.99.60:36310 > 142.251.12.103:https S
2024-03-08 21:50:19.108895 - Ether / IP / TCP 172.24.99.60:36326 > 142.251.12.103:https S
2024-03-08 21:50:19.123935 - Ether / IP / TCP 142.251.12.103:https > 172.24.99.60:36310 SA
2024-03-08 21:50:19.125398 - Ether / IP / TCP 172.24.99.60:36310 > 142.251.12.103:https A
2024-03-08 21:50:19.127395 - Ether / IP / TCP 142.251.12.103:https > 172.24.99.60:36326 SA
2024-03-08 21:50:19.128684 - Ether / IP / TCP 172.24.99.60:36326 > 142.251.12.103:https A
2024-03-08 21:50:19.131502 - Ether / IP / TCP 172.24.99.60:36310 > 142.251.12.103:https PA / Raw
2024-03-08 21:50:19.144811 - Ether / IP / TCP 172.24.99.60:36326 > 142.251.12.103:https PA / Raw
2024-03-08 21:50:19.154246 - Ether / IP / TCP 142.251.12.103:https > 172.24.99.60:36310 A
2024-03-08 21:50:19.156038 - Ether / IP / TCP 142.251.12.103:https > 172.24.99.60:36310 PA / Raw
2024-03-08 21:50:19.157693 - Ether / IP / TCP 172.24.99.60:36310 > 142.251.12.103:https A
2024-03-08 21:50:19.159218 - Ether / IP / TCP 142.251.12.103:https > 172.24.99.60:36310 PA / Raw
2024-03-08 21:50:19.160482 - Ether / IP / TCP 172.24.99.60:36310 > 142.251.12.103:https A
2024-03-08 21:50:19.169838 - Ether / IP / TCP 142.251.12.103:https > 172.24.99.60:36326 A
2024-03-08 21:50:19.171314 - Ether / IP / TCP 142.251.12.103:https > 172.24.99.60:36326 A / Raw
2024-03-08 21:50:19.172470 - Ether / IP / TCP 172.24.99.60:36326 > 142.251.12.103:https A
2024-03-08 21:50:19.173899 - Ether / IP / TCP 142.251.12.103:https > 172.24.99.60:36326 PA / Raw
2024-03-08 21:50:19.175809 - Ether / IP / TCP 172.24.99.60:36326 > 142.251.12.103:https A
2024-03-08 21:50:19.177527 - Ether / IP / TCP 142.251.12.103:https > 172.24.99.60:36326 PA / Raw
2024-03-08 21:50:19.178875 - Ether / IP / TCP 172.24.99.60:36326 > 142.251.12.103:https A
2024-03-08 21:50:19.180317 - Ether / IP / UDP / DNS Qry "b'ocsp.pki.goog.'" 
2024-03-08 21:50:19.181971 - Ether / IP / UDP / DNS Ans "b'pki-goog.l.google.com.'" 
2024-03-08 21:50:19.183276 - Ether / IP / UDP / DNS Qry "b'ocsp.pki.goog.'" 
2024-03-08 21:50:19.184918 - Ether / IP / UDP / DNS Ans "b'pki-goog.l.google.com.'" 
2024-03-08 21:50:19.198446 - Ether / IP / UDP / DNS Qry "b'ocsp.pki.goog.'" 
2024-03-08 21:50:19.199865 - Ether / IP / UDP / DNS Qry "b'ocsp.pki.goog.'" 
2024-03-08 21:50:19.201991 - Ether / IP / UDP / DNS Ans "b'pki-goog.l.google.com.'" 
2024-03-08 21:50:19.203595 - Ether / IP / UDP / DNS Ans "b'pki-goog.l.google.com.'" 
2024-03-08 21:50:19.205750 - Ether / IP / TCP 172.24.99.60:50182 > 64.233.170.94:http S
2024-03-08 21:50:19.208151 - Ether / IP / TCP 172.24.99.60:36328 > 142.251.12.103:https S
2024-03-08 21:50:19.219381 - Ether / IP / UDP / DNS Qry "b'ocsp.pki.goog.'" 
2024-03-08 21:50:19.220946 - Ether / IP / UDP / DNS Qry "b'ocsp.pki.goog.'" 
2024-03-08 21:50:19.223635 - Ether / IP / UDP / DNS Ans "b'pki-goog.l.google.com.'" 
2024-03-08 21:50:19.227804 - Ether / IP / UDP / DNS Ans "b'pki-goog.l.google.com.'" 
2024-03-08 21:50:19.229417 - Ether / IP / UDP / DNS Qry "b'ocsp.pki.goog.'" 
2024-03-08 21:50:19.230935 - Ether / IP / UDP / DNS Ans "b'pki-goog.l.google.com.'" 
2024-03-08 21:50:19.232537 - Ether / IP / UDP / DNS Qry "b'ocsp.pki.goog.'" 
2024-03-08 21:50:19.235188 - Ether / IP / UDP / DNS Ans "b'pki-goog.l.google.com.'" 
2024-03-08 21:50:19.236928 - Ether / IP / TCP 172.24.99.60:50190 > 64.233.170.94:http S
2024-03-08 21:50:19.239051 - Ether / IP / TCP 64.233.170.94:http > 172.24.99.60:50182 SA
2024-03-08 21:50:19.241403 - Ether / IP / TCP 172.24.99.60:50182 > 64.233.170.94:http A
2024-03-08 21:50:19.243112 - Ether / IP / TCP 172.24.99.60:50182 > 64.233.170.94:http PA / Raw
2024-03-08 21:50:19.244713 - Ether / IP / TCP 142.251.12.103:https > 172.24.99.60:36328 SA
2024-03-08 21:50:19.246526 - Ether / IP / TCP 172.24.99.60:36328 > 142.251.12.103:https A
2024-03-08 21:50:19.249002 - Ether / IP / TCP 172.24.99.60:36328 > 142.251.12.103:https PA / Raw
2024-03-08 21:50:19.251103 - Ether / IP / TCP 64.233.170.94:http > 172.24.99.60:50190 SA
2024-03-08 21:50:19.254030 - Ether / IP / TCP 172.24.99.60:50190 > 64.233.170.94:http A
2024-03-08 21:50:19.256382 - Ether / IP / TCP 172.24.99.60:50190 > 64.233.170.94:http PA / Raw
2024-03-08 21:50:19.258608 - Ether / IP / UDP / DNS Qry "b'www.google.com.'" 
2024-03-08 21:50:19.260878 - Ether / IP / UDP / DNS Qry "b'www.google.com.'" 
2024-03-08 21:50:19.262542 - Ether / IP / UDP / DNS Ans "142.251.12.103" 
2024-03-08 21:50:19.265292 - Ether / IP / UDP / DNS Ans "2404:6800:4003:c11::69" 
2024-03-08 21:50:19.267095 - Ether / IP / TCP 64.233.170.94:http > 172.24.99.60:50182 A
2024-03-08 21:50:19.270133 - Ether / IP / TCP 142.251.12.103:https > 172.24.99.60:36328 A
2024-03-08 21:50:19.272810 - Ether / IP / TCP 64.233.170.94:http > 172.24.99.60:50182 PA / Raw
2024-03-08 21:50:19.274655 - Ether / IP / TCP 172.24.99.60:50182 > 64.233.170.94:http A
2024-03-08 21:50:19.276295 - Ether / IP / TCP 142.251.12.103:https > 172.24.99.60:36328 A / Raw
2024-03-08 21:50:19.278143 - Ether / IP / TCP 172.24.99.60:36328 > 142.251.12.103:https A
2024-03-08 21:50:19.280350 - Ether / IP / TCP 142.251.12.103:https > 172.24.99.60:36328 PA / Raw
2024-03-08 21:50:19.282219 - Ether / IP / TCP 172.24.99.60:36328 > 142.251.12.103:https A
2024-03-08 21:50:19.284238 - Ether / IP / TCP 142.251.12.103:https > 172.24.99.60:36328 PA / Raw
2024-03-08 21:50:19.285858 - Ether / IP / TCP 172.24.99.60:36328 > 142.251.12.103:https A
2024-03-08 21:50:19.287854 - Ether / IP / UDP 172.24.99.60:57073 > 142.251.12.103:https / Raw
2024-03-08 21:50:19.289931 - Ether / IP / TCP 172.24.99.60:36310 > 142.251.12.103:https PA / Raw
2024-03-08 21:50:19.292222 - Ether / IP / TCP 172.24.99.60:36310 > 142.251.12.103:https PA / Raw
2024-03-08 21:50:19.297304 - Ether / IP / UDP / DNS Qry "b'ocsp.pki.goog.'" 
2024-03-08 21:50:19.300261 - Ether / IP / UDP / DNS Qry "b'ocsp.pki.goog.'" 
2024-03-08 21:50:19.302413 - Ether / IP / UDP / DNS Ans "b'pki-goog.l.google.com.'" 
2024-03-08 21:50:19.304883 - Ether / IP / TCP 172.24.99.60:50182 > 64.233.170.94:http PA / Raw
2024-03-08 21:50:19.307176 - Ether / IP / UDP / DNS Ans "b'pki-goog.l.google.com.'" 
2024-03-08 21:50:19.309956 - Ether / IP / TCP 64.233.170.94:http > 172.24.99.60:50190 A
2024-03-08 21:50:19.311671 - Ether / IP / TCP 64.233.170.94:http > 172.24.99.60:50190 PA / Raw
2024-03-08 21:50:19.315270 - Ether / IP / TCP 172.24.99.60:50190 > 64.233.170.94:http A
2024-03-08 21:50:19.316677 - Ether / IP / UDP 142.251.12.103:https > 172.24.99.60:57073 / Raw
2024-03-08 21:50:19.318595 - Ether / IP / UDP 142.251.12.103:https > 172.24.99.60:57073 / Raw
2024-03-08 21:50:19.320822 - Ether / IP / UDP 142.251.12.103:https > 172.24.99.60:57073 / Raw
2024-03-08 21:50:19.322655 - Ether / IP / UDP 172.24.99.60:57073 > 142.251.12.103:https / Raw
2024-03-08 21:50:19.324482 - Ether / IP / UDP 172.24.99.60:57073 > 142.251.12.103:https / Raw
2024-03-08 21:50:19.327513 - Ether / IP / TCP 142.251.12.103:https > 172.24.99.60:36310 A
2024-03-08 21:50:19.332918 - Ether / IP / TCP 142.251.12.103:https > 172.24.99.60:36310 PA / Raw
2024-03-08 21:50:19.335020 - Ether / IP / TCP 172.24.99.60:36310 > 142.251.12.103:https A
2024-03-08 21:50:19.338362 - Ether / IP / TCP 142.251.12.103:https > 172.24.99.60:36310 PA / Raw
2024-03-08 21:50:19.341078 - Ether / IP / TCP 172.24.99.60:36310 > 142.251.12.103:https A
2024-03-08 21:50:19.343029 - Ether / IP / TCP 172.24.99.60:36310 > 142.251.12.103:https PA / Raw
2024-03-08 21:50:19.345555 - Ether / IP / TCP 172.24.99.60:36326 > 142.251.12.103:https PA / Raw
2024-03-08 21:50:19.349237 - Ether / IP / TCP 172.24.99.60:36326 > 142.251.12.103:https PA / Raw
2024-03-08 21:50:19.350583 - Ether / IP / TCP 64.233.170.94:http > 172.24.99.60:50182 PA / Raw
2024-03-08 21:50:19.353074 - Ether / IP / UDP 142.251.12.103:https > 172.24.99.60:57073 / Raw
2024-03-08 21:50:19.356847 - Ether / IP / UDP 142.251.12.103:https > 172.24.99.60:57073 / Raw
2024-03-08 21:50:19.359395 - Ether / IP / UDP 142.251.12.103:https > 172.24.99.60:57073 / Raw
2024-03-08 21:50:19.363285 - Ether / IP / UDP 142.251.12.103:https > 172.24.99.60:57073 / Raw
2024-03-08 21:50:19.364653 - Ether / IP / UDP 172.24.99.60:57073 > 142.251.12.103:https / Raw
2024-03-08 21:50:19.366616 - Ether / IP / TCP 142.251.12.103:https > 172.24.99.60:36310 A
2024-03-08 21:50:19.368053 - Ether / IP / TCP 142.251.12.103:https > 172.24.99.60:36326 A
2024-03-08 21:50:19.369629 - Ether / IP / TCP 142.251.12.103:https > 172.24.99.60:36326 PA / Raw
2024-03-08 21:50:19.370896 - Ether / IP / TCP 172.24.99.60:36326 > 142.251.12.103:https A
2024-03-08 21:50:19.372614 - Ether / IP / TCP 142.251.12.103:https > 172.24.99.60:36326 PA / Raw
2024-03-08 21:50:19.374594 - Ether / IP / TCP 172.24.99.60:36326 > 142.251.12.103:https A
2024-03-08 21:50:19.376479 - Ether / IP / TCP 172.24.99.60:36326 > 142.251.12.103:https PA / Raw
2024-03-08 21:50:19.377855 - Ether / IP / TCP 172.24.99.60:36326 > 142.251.12.103:https FA
2024-03-08 21:50:19.379659 - Ether / IP / TCP 172.24.99.60:50190 > 64.233.170.94:http PA / Raw
2024-03-08 21:50:19.381164 - Ether / IP / TCP 172.24.99.60:36328 > 142.251.12.103:https PA / Raw
2024-03-08 21:50:19.383486 - Ether / IP / TCP 172.24.99.60:36328 > 142.251.12.103:https PA / Raw
2024-03-08 21:50:19.385240 - Ether / IP / UDP / DNS Qry "b'ocsp.pki.goog.'" 
2024-03-08 21:50:19.387042 - Ether / IP / UDP / DNS Qry "b'ocsp.pki.goog.'" 
2024-03-08 21:50:19.389047 - Ether / IP / UDP / DNS Ans "b'pki-goog.l.google.com.'" 
2024-03-08 21:50:19.390828 - Ether / IP / UDP / DNS Ans "b'pki-goog.l.google.com.'" 
2024-03-08 21:50:19.392881 - Ether / IP / TCP 172.24.99.60:50182 > 64.233.170.94:http A
2024-03-08 21:50:19.394474 - Ether / IP / TCP 142.251.12.103:https > 172.24.99.60:36326 A
2024-03-08 21:50:19.396155 - Ether / IP / UDP 172.24.99.60:57073 > 142.251.12.103:https / Raw
2024-03-08 21:50:19.397438 - Ether / IP / UDP 172.24.99.60:57073 > 142.251.12.103:https / Raw
2024-03-08 21:50:19.398918 - Ether / IP / TCP 34.120.208.123:https > 172.24.99.60:59222 PA / Raw
2024-03-08 21:50:19.400120 - Ether / IP / TCP 34.120.208.123:https > 172.24.99.60:59222 PA / Raw
2024-03-08 21:50:19.401462 - Ether / IP / TCP 34.120.208.123:https > 172.24.99.60:59222 PA / Raw
2024-03-08 21:50:19.403584 - Ether / IP / TCP 172.24.99.60:59222 > 34.120.208.123:https A
2024-03-08 21:50:19.404849 - Ether / IP / TCP 172.24.99.60:59222 > 34.120.208.123:https PA / Raw
2024-03-08 21:50:19.405927 - Ether / IP / TCP 142.251.12.103:https > 172.24.99.60:36326 A
2024-03-08 21:50:19.407000 - Ether / IP / TCP 142.251.12.103:https > 172.24.99.60:36326 FA
2024-03-08 21:50:19.407957 - Ether / IP / TCP 172.24.99.60:36326 > 142.251.12.103:https A
2024-03-08 21:50:19.409396 - Ether / IP / UDP / DNS Qry "b'incoming.telemetry.mozilla.org.'" 
2024-03-08 21:50:19.410475 - Ether / IP / TCP 172.24.99.60:59222 > 34.120.208.123:https PA / Raw
2024-03-08 21:50:19.412170 - Ether / IP / TCP 172.24.99.60:59222 > 34.120.208.123:https PA / Raw
2024-03-08 21:50:19.414838 - Ether / IP / UDP / DNS Qry "b'incoming.telemetry.mozilla.org.'" 
2024-03-08 21:50:19.416380 - Ether / IP / UDP / DNS Ans "b'telemetry-incoming.r53-2.services.mozilla.com.'" 
2024-03-08 21:50:19.418222 - Ether / IP / UDP / DNS Ans "b'telemetry-incoming.r53-2.services.mozilla.com.'" 
2024-03-08 21:50:19.419570 - Ether / IP / UDP / DNS Qry "b'telemetry-incoming.r53-2.services.mozilla.com.'" 
2024-03-08 21:50:19.420947 - Ether / IP / UDP / DNS Ans 
2024-03-08 21:50:19.421860 - Ether / IP / TCP 142.251.12.103:https > 172.24.99.60:36328 A
2024-03-08 21:50:19.422771 - Ether / IP / TCP 142.251.12.103:https > 172.24.99.60:36328 PA / Raw
2024-03-08 21:50:19.426271 - Ether / IP / TCP 172.24.99.60:36328 > 142.251.12.103:https A
2024-03-08 21:50:19.427587 - Ether / IP / TCP 142.251.12.103:https > 172.24.99.60:36328 PA / Raw
2024-03-08 21:50:19.429084 - Ether / IP / TCP 172.24.99.60:36328 > 142.251.12.103:https A
2024-03-08 21:50:19.430487 - Ether / IP / TCP 172.24.99.60:36328 > 142.251.12.103:https PA / Raw
2024-03-08 21:50:19.437330 - Ether / IP / TCP 172.24.99.60:36328 > 142.251.12.103:https RA
2024-03-08 21:50:19.438375 - Ether / IP / TCP 64.233.170.94:http > 172.24.99.60:50190 PA / Raw
2024-03-08 21:50:19.439752 - Ether / IP / TCP 172.24.99.60:50190 > 64.233.170.94:http A
2024-03-08 21:50:19.441128 - Ether / IP / TCP 34.120.208.123:https > 172.24.99.60:59222 A
2024-03-08 21:50:19.442230 - Ether / IP / TCP 34.120.208.123:https > 172.24.99.60:59222 A
2024-03-08 21:50:19.445093 - Ether / IP / TCP 34.120.208.123:https > 172.24.99.60:59222 A
2024-03-08 21:50:19.452098 - Ether / IP / UDP 142.251.12.103:https > 172.24.99.60:57073 / Raw
2024-03-08 21:50:19.453717 - Ether / IP / UDP 172.24.99.60:57073 > 142.251.12.103:https / Raw
2024-03-08 21:50:19.455193 - Ether / IP / UDP 172.24.99.60:57073 > 142.251.12.103:https / Raw
2024-03-08 21:50:19.456637 - Ether / IP / UDP 172.24.99.60:57073 > 142.251.12.103:https / Raw
2024-03-08 21:50:19.457953 - Ether / IP / TCP 142.251.12.103:https > 172.24.99.60:36328 A
2024-03-08 21:50:19.459036 - Ether / IP / TCP 172.24.99.60:36328 > 142.251.12.103:https R
2024-03-08 21:50:19.459992 - Ether / IP / TCP 142.251.12.103:https > 172.24.99.60:36328 FA
2024-03-08 21:50:19.463193 - Ether / IP / TCP 172.24.99.60:36328 > 142.251.12.103:https R
2024-03-08 21:50:19.464986 - Ether / IP / UDP 142.251.12.103:https > 172.24.99.60:57073 / Raw
2024-03-08 21:50:19.466948 - Ether / IP / UDP 142.251.12.103:https > 172.24.99.60:57073 / Raw
2024-03-08 21:50:19.468261 - Ether / IP / UDP 142.251.12.103:https > 172.24.99.60:57073 / Raw
2024-03-08 21:50:19.469371 - Ether / IP / UDP 172.24.99.60:57073 > 142.251.12.103:https / Raw
2024-03-08 21:50:19.470869 - Ether / IP / UDP 142.251.12.103:https > 172.24.99.60:57073 / Raw
2024-03-08 21:50:19.471879 - Ether / IP / UDP 172.24.99.60:57073 > 142.251.12.103:https / Raw
2024-03-08 21:50:19.473326 - Ether / IP / UDP 142.251.12.103:https > 172.24.99.60:57073 / Raw
2024-03-08 21:50:19.474718 - Ether / IP / UDP 142.251.12.103:https > 172.24.99.60:57073 / Raw
2024-03-08 21:50:19.475834 - Ether / IP / UDP 172.24.99.60:57073 > 142.251.12.103:https / Raw
2024-03-08 21:50:19.477457 - Ether / IP / UDP 142.251.12.103:https > 172.24.99.60:57073 / Raw
2024-03-08 21:50:24.796573 - Ether / IP / UDP / DNS Qry "b'connectivity-check.ubuntu.com.'" 
2024-03-08 21:50:25.064778 - Ether / IP / UDP / DNS Ans "2620:2d:4000:1::2a" 
2024-03-08 21:50:25.997438 - Ether / IPv6 / UDP / DNS Qry "b'_ipp._tcp.local.'" 
2024-03-08 21:50:25.998941 - Ether / IP / UDP / DNS Qry "b'_ipp._tcp.local.'" 
2024-03-08 21:50:26.217462 - Ether / IP / TCP 172.24.99.60:44638 > 34.107.221.82:http A
2024-03-08 21:50:26.229251 - Ether / IP / TCP 34.107.221.82:http > 172.24.99.60:44638 A
2024-03-08 21:50:26.473886 - Ether / IP / TCP 172.24.99.60:44646 > 34.107.221.82:http A
2024-03-08 21:50:26.496273 - Ether / IP / TCP 34.107.221.82:http > 172.24.99.60:44646 A
2024-03-08 21:50:27.619456 - Ether / IP / TCP 172.24.99.60:36576 > 118.98.77.121:http FA
2024-03-08 21:50:28.009731 - Ether / IP / TCP 172.24.99.60:50170 > 64.233.170.94:http A
2024-03-08 21:50:28.012039 - Ether / IP / TCP 172.24.99.60:36586 > 118.98.77.121:http S
2024-03-08 21:50:28.031670 - Ether / IP / TCP 64.233.170.94:http > 172.24.99.60:50170 A
2024-03-08 21:50:28.265847 - Ether / IP / TCP 172.24.99.60:50692 > 152.195.38.76:http A
2024-03-08 21:50:28.266989 - Ether / IP / TCP 172.24.99.60:36592 > 118.98.77.121:http S
2024-03-08 21:50:28.286130 - Ether / IP / TCP 152.195.38.76:http > 172.24.99.60:50692 A
2024-03-08 21:50:28.362240 - Ether / IP / TCP 172.24.99.60:36602 > 118.98.77.121:http A
2024-03-08 21:50:28.372548 - Ether / IP / TCP 118.98.77.121:http > 172.24.99.60:36602 A
2024-03-08 21:50:29.297695 - Ether / IP / TCP 172.24.99.60:50182 > 64.233.170.94:http A
2024-03-08 21:50:29.319944 - Ether / IP / TCP 64.233.170.94:http > 172.24.99.60:50182 A
2024-03-08 21:50:34.730721 - Ether / IP / UDP / DNS Qry "b'metrics.ubuntu.com.'" 
2024-03-08 21:50:34.732599 - Ether / IP / UDP / DNS Qry "b'metrics.ubuntu.com.'" 
2024-03-08 21:50:34.734947 - Ether / IP / UDP / DNS Ans "162.213.33.48" 
2024-03-08 21:50:34.784456 - Ether / IP / UDP / DNS Ans 
2024-03-08 21:50:34.786019 - Ether / IP / TCP 172.24.99.60:50442 > 162.213.33.48:https S
2024-03-08 21:50:35.785833 - Ether / IP / TCP 172.24.99.60:50442 > 162.213.33.48:https S
2024-03-08 21:50:36.201708 - Ether / IP / TCP 172.24.99.60:36586 > 118.98.77.121:http S
2024-03-08 21:50:36.457702 - Ether / IP / TCP 172.24.99.60:36592 > 118.98.77.121:http S
2024-03-08 21:50:36.459254 - Ether / IP / TCP 172.24.99.60:44638 > 34.107.221.82:http A
2024-03-08 21:50:36.468443 - Ether / IP / TCP 34.107.221.82:http > 172.24.99.60:44638 A
2024-03-08 21:50:36.713909 - Ether / IP / TCP 172.24.99.60:44646 > 34.107.221.82:http A
2024-03-08 21:50:36.738508 - Ether / IP / TCP 34.107.221.82:http > 172.24.99.60:44646 A
2024-03-08 21:50:36.809895 - Ether / IP / TCP 172.24.99.60:50442 > 162.213.33.48:https S
2024-03-08 21:50:37.834103 - Ether / IP / TCP 172.24.99.60:50442 > 162.213.33.48:https S
2024-03-08 21:50:38.249873 - Ether / IP / TCP 172.24.99.60:36576 > 118.98.77.121:http FA
2024-03-08 21:50:38.251317 - Ether / IP / TCP 172.24.99.60:50170 > 64.233.170.94:http A
2024-03-08 21:50:38.272065 - Ether / IP / TCP 64.233.170.94:http > 172.24.99.60:50170 A
2024-03-08 21:50:38.291271 - Ether / IP / TCP 118.98.77.121:http > 172.24.99.60:36576 A
2024-03-08 21:50:38.505748 - Ether / IP / TCP 172.24.99.60:50692 > 152.195.38.76:http A
2024-03-08 21:50:38.506922 - Ether / IP / TCP 172.24.99.60:36602 > 118.98.77.121:http A
2024-03-08 21:50:38.514301 - Ether / IP / TCP 118.98.77.121:http > 172.24.99.60:36602 A
2024-03-08 21:50:38.523808 - Ether / IP / TCP 152.195.38.76:http > 172.24.99.60:50692 A
2024-03-08 21:50:38.857924 - Ether / IP / TCP 172.24.99.60:50442 > 162.213.33.48:https S
2024-03-08 21:50:39.529862 - Ether / IP / TCP 172.24.99.60:50182 > 64.233.170.94:http A
2024-03-08 21:50:39.553097 - Ether / IP / TCP 64.233.170.94:http > 172.24.99.60:50182 A
2024-03-08 21:50:46.698242 - Ether / IP / TCP 172.24.99.60:44638 > 34.107.221.82:http A
2024-03-08 21:50:46.713890 - Ether / IP / TCP 34.107.221.82:http > 172.24.99.60:44638 A
2024-03-08 21:50:46.953637 - Ether / IP / TCP 172.24.99.60:44646 > 34.107.221.82:http A
2024-03-08 21:50:46.975733 - Ether / IP / TCP 34.107.221.82:http > 172.24.99.60:44646 A
2024-03-08 21:50:48.083890 - Ether / IP / UDP 172.24.96.1:56237 > 239.255.255.250:1900 / Raw
2024-03-08 21:50:48.489621 - Ether / IP / TCP 172.24.99.60:50170 > 64.233.170.94:http A
2024-03-08 21:50:48.514854 - Ether / IP / TCP 64.233.170.94:http > 172.24.99.60:50170 A
2024-03-08 21:50:48.745594 - Ether / IP / TCP 172.24.99.60:36602 > 118.98.77.121:http A
2024-03-08 21:50:48.749742 - Ether / IP / TCP 172.24.99.60:50692 > 152.195.38.76:http A
2024-03-08 21:50:48.771450 - Ether / IP / TCP 152.195.38.76:http > 172.24.99.60:50692 A
2024-03-08 21:50:49.085392 - Ether / IP / UDP 172.24.96.1:56237 > 239.255.255.250:1900 / Raw
2024-03-08 21:50:56.938336 - Ether / IP / TCP 172.24.99.60:44638 > 34.107.221.82:http A
2024-03-08 21:50:56.945254 - Ether / IP / TCP 34.107.221.82:http > 172.24.99.60:44638 A
2024-03-08 21:50:57.194069 - Ether / IP / TCP 172.24.99.60:44646 > 34.107.221.82:http A
2024-03-08 21:50:57.219091 - Ether / IP / TCP 34.107.221.82:http > 172.24.99.60:44646 A
2024-03-08 21:50:58.734123 - Ether / IP / TCP 172.24.99.60:50170 > 64.233.170.94:http A
2024-03-08 21:50:58.752634 - Ether / IP / TCP 64.233.170.94:http > 172.24.99.60:50170 A
2024-03-08 21:50:58.986183 - Ether / IP / TCP 172.24.99.60:50692 > 152.195.38.76:http A
2024-03-08 21:50:59.007472 - Ether / IP / TCP 152.195.38.76:http > 172.24.99.60:50692 A
2024-03-08 21:58:48.105248 - Ether / IP / UDP 172.24.96.1:58657 > 239.255.255.250:1900 / Raw
2024-03-08 21:58:49.119737 - Ether / IP / UDP 172.24.96.1:58657 > 239.255.255.250:1900 / Raw
2024-03-08 21:58:50.124524 - Ether / IP / UDP 172.24.96.1:58657 > 239.255.255.250:1900 / Raw
2024-03-08 21:58:51.129034 - Ether / IP / UDP 172.24.96.1:58657 > 239.255.255.250:1900 / Raw
2024-03-08 21:59:10.370685 - Ether / IP / UDP / DNS Qry "b'_http._tcp.id.archive.ubuntu.com.'" 
2024-03-08 21:59:10.641684 - Ether / IP / UDP / DNS Ans 
2024-03-08 21:59:10.643198 - Ether / IP / UDP / DNS Qry "b'id.archive.ubuntu.com.'" 
2024-03-08 21:59:10.644653 - Ether / IP / UDP / DNS Qry "b'id.archive.ubuntu.com.'" 
2024-03-08 21:59:10.668542 - Ether / IP / UDP / DNS Ans 
2024-03-08 21:59:10.670551 - Ether / IP / ICMP / IPerror / UDPerror / DNS Ans 
2024-03-08 22:00:43.058195 - Ether / IP / UDP 172.24.99.60:54999 > 64.233.170.154:https / Raw
2024-03-08 22:00:43.062159 - Ether / IP / TCP 34.120.208.123:https > 172.24.99.60:34692 A
2024-03-08 22:00:43.064509 - Ether / IP / TCP 172.217.194.156:https > 172.24.99.60:32844 PA / Raw
2024-03-08 22:00:43.066896 - Ether / IP / TCP 172.217.194.156:https > 172.24.99.60:32844 PA / Raw
2024-03-08 22:00:43.070783 - Ether / IP / UDP / DNS Ans "104.244.42.129" 
2024-03-08 22:00:43.073588 - Ether / IP / UDP / DNS Ans 
2024-03-08 22:00:43.076539 - Ether / IP / UDP / DNS Ans 
2024-03-08 22:00:43.078969 - Ether / IP / UDP 64.233.170.154:https > 172.24.99.60:45796 / Raw
2024-03-08 22:00:43.081812 - Ether / IP / UDP 64.233.170.154:https > 172.24.99.60:45796 / Raw
2024-03-08 22:00:43.085297 - Ether / IP / UDP 64.233.170.154:https > 172.24.99.60:45796 / Raw
2024-03-08 22:00:43.088398 - Ether / IP / UDP 64.233.170.154:https > 172.24.99.60:54999 / Raw
2024-03-08 22:00:43.092006 - Ether / IP / TCP 172.24.99.60:32844 > 172.217.194.156:https PA / Raw
2024-03-08 22:00:43.094804 - Ether / IP / UDP 172.24.99.60:45796 > 64.233.170.154:https / Raw
2024-03-08 22:00:43.112779 - Ether / IP / UDP 64.233.170.154:https > 172.24.99.60:45796 / Raw
2024-03-08 22:00:43.114900 - Ether / IP / TCP 172.217.194.156:https > 172.24.99.60:32844 A
2024-03-08 22:00:43.117578 - Ether / IP / UDP 64.233.170.154:https > 172.24.99.60:45796 / Raw
2024-03-08 22:00:43.120663 - Ether / IP / UDP 172.24.99.60:45796 > 64.233.170.154:https / Raw
2024-03-08 22:00:43.123334 - Ether / IP / TCP 172.24.99.60:51352 > 74.125.130.94:http PA / Raw
2024-03-08 22:00:43.124852 - Ether / IP / UDP / DNS Qry "b'ocsp.pki.goog.'" 
2024-03-08 22:00:43.126355 - Ether / IP / UDP / DNS Qry "b'ocsp.pki.goog.'" 
2024-03-08 22:00:43.129803 - Ether / IP / UDP / DNS Ans "b'pki-goog.l.google.com.'" 
2024-03-08 22:00:43.131804 - Ether / IP / UDP / DNS Ans "b'pki-goog.l.google.com.'" 
2024-03-08 22:00:43.146030 - Ether / IP / TCP 74.125.130.94:http > 172.24.99.60:51352 PA / Raw
2024-03-08 22:00:43.147424 - Ether / IP / TCP 172.24.99.60:51352 > 74.125.130.94:http A
2024-03-08 22:00:43.149854 - Ether / IP / TCP 172.24.99.60:42908 > 64.233.170.154:https S
2024-03-08 22:00:43.158064 - Ether / IP / UDP 172.24.99.60:45796 > 64.233.170.154:https / Raw
2024-03-08 22:00:43.163674 - Ether / IP / UDP 172.24.99.60:45796 > 64.233.170.154:https / Raw
2024-03-08 22:00:43.171152 - Ether / IP / TCP 64.233.170.154:https > 172.24.99.60:42908 SA
2024-03-08 22:00:43.172785 - Ether / IP / TCP 172.24.99.60:42908 > 64.233.170.154:https A
2024-03-08 22:00:43.174328 - Ether / IP / UDP 172.24.99.60:45796 > 64.233.170.154:https / Raw
2024-03-08 22:00:43.182704 - Ether / IP / TCP 172.24.99.60:42908 > 64.233.170.154:https PA / Raw
2024-03-08 22:00:43.192710 - Ether / IP / UDP 64.233.170.154:https > 172.24.99.60:45796 / Raw
2024-03-08 22:00:43.194948 - Ether / IP / UDP 64.233.170.154:https > 172.24.99.60:45796 / Raw
2024-03-08 22:00:43.196531 - Ether / IP / UDP 64.233.170.154:https > 172.24.99.60:45796 / Raw
2024-03-08 22:00:43.198220 - Ether / IP / UDP 64.233.170.154:https > 172.24.99.60:45796 / Raw
2024-03-08 22:00:43.200253 - Ether / IP / UDP 64.233.170.154:https > 172.24.99.60:45796 / Raw
2024-03-08 22:00:43.207765 - Ether / IP / UDP 172.24.99.60:45796 > 64.233.170.154:https / Raw
2024-03-08 22:00:43.209827 - Ether / IP / TCP 64.233.170.154:https > 172.24.99.60:42908 A
2024-03-08 22:00:43.210899 - Ether / IP / TCP 64.233.170.154:https > 172.24.99.60:42908 PA / Raw
2024-03-08 22:00:43.212622 - Ether / IP / TCP 172.24.99.60:42908 > 64.233.170.154:https A
2024-03-08 22:00:43.214472 - Ether / IP / TCP 64.233.170.154:https > 172.24.99.60:42908 PA / Raw
2024-03-08 22:00:43.216853 - Ether / IP / TCP 172.24.99.60:42908 > 64.233.170.154:https A
2024-03-08 22:00:43.237150 - Ether / IP / TCP 172.24.99.60:42908 > 64.233.170.154:https PA / Raw
2024-03-08 22:00:43.238478 - Ether / IP / TCP 172.24.99.60:42908 > 64.233.170.154:https PA / Raw
2024-03-08 22:00:43.256970 - Ether / IP / UDP 64.233.170.154:https > 172.24.99.60:45796 / Raw
2024-03-08 22:00:43.260100 - Ether / IP / TCP 64.233.170.154:https > 172.24.99.60:42908 PA / Raw
2024-03-08 22:00:43.261842 - Ether / IP / TCP 172.24.99.60:42908 > 64.233.170.154:https PA / Raw
2024-03-08 22:00:43.264960 - Ether / IP / TCP 64.233.170.154:https > 172.24.99.60:42908 PA / Raw
2024-03-08 22:00:43.274769 - Ether / IP / UDP 172.24.99.60:33679 > 142.251.10.156:https / Raw
2024-03-08 22:00:43.279721 - Ether / IP / UDP / DNS Ans "b'tp.47cf2c8c9-frontier.amazon.com.'" 
2024-03-08 22:00:43.288342 - Ether / IP / TCP 64.233.170.154:https > 172.24.99.60:42908 A
2024-03-08 22:00:43.296737 - Ether / IP / UDP 142.251.10.156:https > 172.24.99.60:33679 / Raw
2024-03-08 22:00:43.299321 - Ether / IP / UDP 142.251.10.156:https > 172.24.99.60:33679 / Raw
2024-03-08 22:00:43.301737 - Ether / IP / UDP 142.251.10.156:https > 172.24.99.60:33679 / Raw
2024-03-08 22:00:43.302850 - Ether / IP / UDP 172.24.99.60:33679 > 142.251.10.156:https / Raw
2024-03-08 22:00:43.308368 - Ether / IP / TCP 172.24.99.60:42908 > 64.233.170.154:https A
2024-03-08 22:00:43.316602 - Ether / IP / UDP 172.24.99.60:54999 > 64.233.170.154:https / Raw
2024-03-08 22:00:43.347741 - Ether / IP / UDP 64.233.170.154:https > 172.24.99.60:54999 / Raw
2024-03-08 22:00:43.349436 - Ether / IP / UDP 64.233.170.154:https > 172.24.99.60:54999 / Raw
2024-03-08 22:00:43.351356 - Ether / IP / UDP 64.233.170.154:https > 172.24.99.60:54999 / Raw
2024-03-08 22:00:43.353295 - Ether / IP / UDP 142.251.10.156:https > 172.24.99.60:33679 / Raw
2024-03-08 22:00:43.354959 - Ether / IP / UDP 172.24.99.60:54999 > 64.233.170.154:https / Raw
2024-03-08 22:00:43.396259 - Ether / IP / UDP 172.24.99.60:45796 > 64.233.170.154:https / Raw
2024-03-08 22:00:43.400722 - Ether / IP / UDP 64.233.170.154:https > 172.24.99.60:54999 / Raw
2024-03-08 22:00:43.404353 - Ether / IP / UDP / DNS Ans "b'tp.47cf2c8c9-frontier.amazon.com.'" 
2024-03-08 22:00:43.419959 - Ether / IP / UDP 64.233.170.154:https > 172.24.99.60:45796 / Raw
2024-03-08 22:00:43.422380 - Ether / IP / UDP 64.233.170.154:https > 172.24.99.60:45796 / Raw
2024-03-08 22:00:43.424319 - Ether / IP / UDP 172.24.99.60:45796 > 64.233.170.154:https / Raw
2024-03-08 22:00:43.426220 - Ether / IP / UDP 64.233.170.154:https > 172.24.99.60:45796 / Raw
2024-03-08 22:00:43.447360 - Ether / IP / UDP 172.24.99.60:45796 > 64.233.170.154:https / Raw
2024-03-08 22:00:43.470922 - Ether / IP / UDP 64.233.170.154:https > 172.24.99.60:45796 / Raw
2024-03-08 22:00:43.754888 - Ether / IP / UDP 172.24.99.60:44880 > 142.251.175.103:https / Raw
2024-03-08 22:00:43.777212 - Ether / IP / UDP 142.251.175.103:https > 172.24.99.60:44880 / Raw
2024-03-08 22:00:43.785214 - Ether / IP / UDP 142.251.175.103:https > 172.24.99.60:44880 / Raw
2024-03-08 22:00:43.787461 - Ether / IP / UDP 142.251.175.103:https > 172.24.99.60:44880 / Raw
2024-03-08 22:00:43.789127 - Ether / IP / UDP 172.24.99.60:44880 > 142.251.175.103:https / Raw
2024-03-08 22:00:43.834987 - Ether / IP / UDP 142.251.175.103:https > 172.24.99.60:44880 / Raw
2024-03-08 22:00:45.154399 - Ether / IP / UDP / DNS Qry "b'www.gstatic.com.'" 
2024-03-08 22:00:45.156333 - Ether / IP / UDP / DNS Qry "b'www.gstatic.com.'" 
2024-03-08 22:00:45.157813 - Ether / IP / UDP / DNS Ans "142.251.10.94" 
2024-03-08 22:00:45.159846 - Ether / IP / UDP / DNS Ans "2404:6800:4003:c03::5e" 
2024-03-08 22:00:45.161165 - Ether / IP / TCP 172.24.99.60:50582 > 142.251.10.94:https S
2024-03-08 22:00:45.176113 - Ether / IP / TCP 142.251.10.94:https > 172.24.99.60:50582 SA
2024-03-08 22:00:45.177361 - Ether / IP / TCP 172.24.99.60:50582 > 142.251.10.94:https A
2024-03-08 22:00:45.179237 - Ether / IP / TCP 172.24.99.60:50582 > 142.251.10.94:https PA / Raw
2024-03-08 22:00:45.183467 - Ether / IP / UDP 172.24.99.60:44880 > 142.251.175.103:https / Raw
2024-03-08 22:00:45.198710 - Ether / IP / TCP 142.251.10.94:https > 172.24.99.60:50582 A
2024-03-08 22:00:45.200663 - Ether / IP / TCP 142.251.10.94:https > 172.24.99.60:50582 PA / Raw
2024-03-08 22:00:45.202163 - Ether / IP / TCP 172.24.99.60:50582 > 142.251.10.94:https A
2024-03-08 22:00:45.204054 - Ether / IP / TCP 142.251.10.94:https > 172.24.99.60:50582 PA / Raw
2024-03-08 22:00:45.205804 - Ether / IP / TCP 172.24.99.60:50582 > 142.251.10.94:https A
2024-03-08 22:00:45.207214 - Ether / IP / UDP 142.251.175.103:https > 172.24.99.60:44880 / Raw
2024-03-08 22:00:45.213390 - Ether / IP / TCP 172.24.99.60:50582 > 142.251.10.94:https PA / Raw
2024-03-08 22:00:45.215416 - Ether / IP / TCP 172.24.99.60:50582 > 142.251.10.94:https PA / Raw
2024-03-08 22:00:45.231416 - Ether / IP / UDP 172.24.99.60:44880 > 142.251.175.103:https / Raw
2024-03-08 22:00:45.234023 - Ether / IP / TCP 142.251.10.94:https > 172.24.99.60:50582 PA / Raw
2024-03-08 22:00:45.235483 - Ether / IP / TCP 142.251.10.94:https > 172.24.99.60:50582 PA / Raw
2024-03-08 22:00:45.237219 - Ether / IP / TCP 172.24.99.60:50582 > 142.251.10.94:https PA / Raw
2024-03-08 22:00:45.270063 - Ether / IP / TCP 142.251.10.94:https > 172.24.99.60:50582 A
2024-03-08 22:00:45.296166 - Ether / IP / UDP 142.251.175.103:https > 172.24.99.60:44880 / Raw
2024-03-08 22:00:45.297993 - Ether / IP / UDP 142.251.175.103:https > 172.24.99.60:44880 / Raw
2024-03-08 22:00:45.300500 - Ether / IP / UDP 142.251.175.103:https > 172.24.99.60:44880 / Raw
2024-03-08 22:00:45.302281 - Ether / IP / UDP 172.24.99.60:44880 > 142.251.175.103:https / Raw
2024-03-08 22:00:45.304475 - Ether / IP / UDP 142.251.175.103:https > 172.24.99.60:44880 / Raw
2024-03-08 22:00:45.306215 - Ether / IP / UDP 142.251.175.103:https > 172.24.99.60:44880 / Raw
2024-03-08 22:00:45.308462 - Ether / IP / UDP 142.251.175.103:https > 172.24.99.60:44880 / Raw
2024-03-08 22:00:45.310476 - Ether / IP / UDP 142.251.175.103:https > 172.24.99.60:44880 / Raw
2024-03-08 22:00:45.311961 - Ether / IP / UDP 172.24.99.60:44880 > 142.251.175.103:https / Raw
2024-03-08 22:00:45.314151 - Ether / IP / UDP 142.251.175.103:https > 172.24.99.60:44880 / Raw
2024-03-08 22:00:45.315844 - Ether / IP / UDP 142.251.175.103:https > 172.24.99.60:44880 / Raw
2024-03-08 22:00:45.317477 - Ether / IP / UDP 172.24.99.60:44880 > 142.251.175.103:https / Raw
2024-03-08 22:00:45.318822 - Ether / IP / UDP 172.24.99.60:44880 > 142.251.175.103:https / Raw
2024-03-08 22:00:45.320507 - Ether / IP / UDP 142.251.175.103:https > 172.24.99.60:44880 / Raw
2024-03-08 22:00:45.321841 - Ether / IP / UDP 142.251.175.103:https > 172.24.99.60:44880 / Raw
2024-03-08 22:00:45.323815 - Ether / IP / UDP 142.251.175.103:https > 172.24.99.60:44880 / Raw
2024-03-08 22:00:45.325394 - Ether / IP / UDP 142.251.175.103:https > 172.24.99.60:44880 / Raw
2024-03-08 22:00:45.327162 - Ether / IP / UDP 142.251.175.103:https > 172.24.99.60:44880 / Raw
2024-03-08 22:00:45.328486 - Ether / IP / UDP 142.251.175.103:https > 172.24.99.60:44880 / Raw
2024-03-08 22:00:45.330170 - Ether / IP / UDP 142.251.175.103:https > 172.24.99.60:44880 / Raw
2024-03-08 22:00:45.331667 - Ether / IP / UDP 142.251.175.103:https > 172.24.99.60:44880 / Raw
2024-03-08 22:00:45.333924 - Ether / IP / UDP 142.251.175.103:https > 172.24.99.60:44880 / Raw
2024-03-08 22:00:45.335221 - Ether / IP / UDP 142.251.175.103:https > 172.24.99.60:44880 / Raw
2024-03-08 22:00:45.336971 - Ether / IP / UDP 172.24.99.60:44880 > 142.251.175.103:https / Raw
2024-03-08 22:00:45.338370 - Ether / IP / UDP 142.251.175.103:https > 172.24.99.60:44880 / Raw
2024-03-08 22:00:45.340512 - Ether / IP / UDP 142.251.175.103:https > 172.24.99.60:44880 / Raw
2024-03-08 22:00:45.342114 - Ether / IP / UDP 142.251.175.103:https > 172.24.99.60:44880 / Raw
2024-03-08 22:00:45.343760 - Ether / IP / UDP 142.251.175.103:https > 172.24.99.60:44880 / Raw
2024-03-08 22:00:45.345472 - Ether / IP / UDP 142.251.175.103:https > 172.24.99.60:44880 / Raw
2024-03-08 22:00:45.347346 - Ether / IP / UDP 142.251.175.103:https > 172.24.99.60:44880 / Raw
2024-03-08 22:00:45.348701 - Ether / IP / UDP 172.24.99.60:44880 > 142.251.175.103:https / Raw
2024-03-08 22:00:45.350235 - Ether / IP / UDP 142.251.175.103:https > 172.24.99.60:44880 / Raw
2024-03-08 22:00:45.351609 - Ether / IP / UDP 172.24.99.60:44880 > 142.251.175.103:https / Raw
2024-03-08 22:00:45.353350 - Ether / IP / UDP 142.251.175.103:https > 172.24.99.60:44880 / Raw
2024-03-08 22:00:45.355446 - Ether / IP / UDP 142.251.175.103:https > 172.24.99.60:44880 / Raw
2024-03-08 22:00:45.357068 - Ether / IP / UDP 172.24.99.60:44880 > 142.251.175.103:https / Raw
2024-03-08 22:00:45.359053 - Ether / IP / UDP 142.251.175.103:https > 172.24.99.60:44880 / Raw
2024-03-08 22:00:45.360634 - Ether / IP / UDP 142.251.175.103:https > 172.24.99.60:44880 / Raw
2024-03-08 22:00:45.362183 - Ether / IP / UDP 142.251.175.103:https > 172.24.99.60:44880 / Raw
2024-03-08 22:00:45.364047 - Ether / IP / UDP 172.24.99.60:44880 > 142.251.175.103:https / Raw
2024-03-08 22:00:45.365402 - Ether / IP / UDP 142.251.175.103:https > 172.24.99.60:44880 / Raw
2024-03-08 22:00:45.367233 - Ether / IP / UDP 142.251.175.103:https > 172.24.99.60:44880 / Raw
2024-03-08 22:00:45.368671 - Ether / IP / UDP 142.251.175.103:https > 172.24.99.60:44880 / Raw
2024-03-08 22:00:45.370584 - Ether / IP / UDP 172.24.99.60:44880 > 142.251.175.103:https / Raw
2024-03-08 22:00:45.374458 - Ether / IP / UDP 142.251.175.103:https > 172.24.99.60:44880 / Raw
2024-03-08 22:00:45.375964 - Ether / IP / UDP 142.251.175.103:https > 172.24.99.60:44880 / Raw
2024-03-08 22:00:45.377342 - Ether / IP / UDP 172.24.99.60:44880 > 142.251.175.103:https / Raw
2024-03-08 22:00:45.378520 - Ether / IP / UDP 142.251.175.103:https > 172.24.99.60:44880 / Raw
2024-03-08 22:00:45.379894 - Ether / IP / UDP 142.251.175.103:https > 172.24.99.60:44880 / Raw
2024-03-08 22:00:45.381309 - Ether / IP / UDP 142.251.175.103:https > 172.24.99.60:44880 / Raw
2024-03-08 22:00:45.382790 - Ether / IP / UDP 142.251.175.103:https > 172.24.99.60:44880 / Raw
2024-03-08 22:00:45.383974 - Ether / IP / UDP 172.24.99.60:44880 > 142.251.175.103:https / Raw
2024-03-08 22:00:45.385471 - Ether / IP / UDP 142.251.175.103:https > 172.24.99.60:44880 / Raw
2024-03-08 22:00:45.387179 - Ether / IP / UDP 172.24.99.60:44880 > 142.251.175.103:https / Raw
2024-03-08 22:00:45.388627 - Ether / IP / UDP 172.24.99.60:44880 > 142.251.175.103:https / Raw
2024-03-08 22:00:45.390117 - Ether / IP / UDP 142.251.175.103:https > 172.24.99.60:44880 / Raw
2024-03-08 22:00:45.392016 - Ether / IP / UDP 142.251.175.103:https > 172.24.99.60:44880 / Raw
2024-03-08 22:00:45.394038 - Ether / IP / UDP 142.251.175.103:https > 172.24.99.60:44880 / Raw
2024-03-08 22:00:45.396020 - Ether / IP / UDP 172.24.99.60:44880 > 142.251.175.103:https / Raw
2024-03-08 22:00:45.422136 - Ether / IP / UDP 142.251.175.103:https > 172.24.99.60:44880 / Raw
2024-03-08 22:00:45.459225 - Ether / IP / UDP 172.24.99.60:44880 > 142.251.175.103:https / Raw
2024-03-08 22:00:45.481006 - Ether / IP / UDP 142.251.175.103:https > 172.24.99.60:44880 / Raw
2024-03-08 22:00:45.486744 - Ether / IP / UDP 142.251.175.103:https > 172.24.99.60:44880 / Raw
2024-03-08 22:00:45.488709 - Ether / IP / UDP 142.251.175.103:https > 172.24.99.60:44880 / Raw
2024-03-08 22:00:45.490208 - Ether / IP / UDP 172.24.99.60:44880 > 142.251.175.103:https / Raw
2024-03-08 22:00:45.533854 - Ether / IP / UDP 142.251.175.103:https > 172.24.99.60:44880 / Raw
2024-03-08 22:00:45.685179 - Ether / IP / UDP 172.24.99.60:44880 > 142.251.175.103:https / Raw
2024-03-08 22:00:45.707160 - Ether / IP / UDP 172.24.99.60:44880 > 142.251.175.103:https / Raw
2024-03-08 22:00:45.708828 - Ether / IP / UDP 142.251.175.103:https > 172.24.99.60:44880 / Raw
2024-03-08 22:00:45.713122 - Ether / IP / UDP 142.251.175.103:https > 172.24.99.60:44880 / Raw
2024-03-08 22:00:45.715171 - Ether / IP / UDP 142.251.175.103:https > 172.24.99.60:44880 / Raw
2024-03-08 22:00:45.716621 - Ether / IP / UDP 172.24.99.60:44880 > 142.251.175.103:https / Raw
2024-03-08 22:00:45.721766 - Ether / IP / UDP 172.24.99.60:44880 > 142.251.175.103:https / Raw
2024-03-08 22:00:45.729279 - Ether / IP / UDP 142.251.175.103:https > 172.24.99.60:44880 / Raw
2024-03-08 22:00:45.744765 - Ether / IP / UDP 142.251.175.103:https > 172.24.99.60:44880 / Raw
2024-03-08 22:00:45.746643 - Ether / IP / UDP 172.24.99.60:44880 > 142.251.175.103:https / Raw
2024-03-08 22:00:45.753058 - Ether / IP / UDP 142.251.175.103:https > 172.24.99.60:44880 / Raw
2024-03-08 22:00:45.755204 - Ether / IP / UDP 142.251.175.103:https > 172.24.99.60:44880 / Raw
2024-03-08 22:00:45.756680 - Ether / IP / UDP 172.24.99.60:44880 > 142.251.175.103:https / Raw
2024-03-08 22:00:45.794794 - Ether / IP / UDP 142.251.175.103:https > 172.24.99.60:44880 / Raw
2024-03-08 22:00:45.796389 - Ether / IP / UDP 142.251.175.103:https > 172.24.99.60:44880 / Raw
2024-03-08 22:00:45.798160 - Ether / IP / UDP 142.251.175.103:https > 172.24.99.60:44880 / Raw
2024-03-08 22:00:45.800451 - Ether / IP / UDP 172.24.99.60:44880 > 142.251.175.103:https / Raw
2024-03-08 22:00:45.801968 - Ether / IP / UDP 142.251.175.103:https > 172.24.99.60:44880 / Raw
2024-03-08 22:00:45.803963 - Ether / IP / UDP 142.251.175.103:https > 172.24.99.60:44880 / Raw
2024-03-08 22:00:45.805563 - Ether / IP / UDP 172.24.99.60:44880 > 142.251.175.103:https / Raw
2024-03-08 22:00:45.810515 - Ether / IP / UDP 172.24.99.60:44880 > 142.251.175.103:https / Raw
2024-03-08 22:00:45.813698 - Ether / IP / UDP 172.24.99.60:44880 > 142.251.175.103:https / Raw
2024-03-08 22:00:45.822242 - Ether / IP / UDP 172.24.99.60:44880 > 142.251.175.103:https / Raw
2024-03-08 22:00:45.823865 - Ether / IP / UDP 172.24.99.60:44880 > 142.251.175.103:https / Raw
2024-03-08 22:00:45.827163 - Ether / IP / UDP 172.24.99.60:44880 > 142.251.175.103:https / Raw
2024-03-08 22:00:45.837464 - Ether / IP / UDP 142.251.175.103:https > 172.24.99.60:44880 / Raw
2024-03-08 22:00:45.838748 - Ether / IP / UDP 142.251.175.103:https > 172.24.99.60:44880 / Raw
2024-03-08 22:00:45.840132 - Ether / IP / UDP 172.24.99.60:44880 > 142.251.175.103:https / Raw
2024-03-08 22:00:45.841688 - Ether / IP / UDP 142.251.175.103:https > 172.24.99.60:44880 / Raw
2024-03-08 22:00:45.843116 - Ether / IP / UDP 142.251.175.103:https > 172.24.99.60:44880 / Raw
2024-03-08 22:00:45.844499 - Ether / IP / UDP 142.251.175.103:https > 172.24.99.60:44880 / Raw
2024-03-08 22:00:45.845861 - Ether / IP / UDP 142.251.175.103:https > 172.24.99.60:44880 / Raw
2024-03-08 22:00:45.847576 - Ether / IP / UDP 172.24.99.60:44880 > 142.251.175.103:https / Raw
2024-03-08 22:00:45.848950 - Ether / IP / UDP 172.24.99.60:44880 > 142.251.175.103:https / Raw
2024-03-08 22:00:45.850702 - Ether / IP / UDP 142.251.175.103:https > 172.24.99.60:44880 / Raw
2024-03-08 22:00:45.852307 - Ether / IP / UDP 142.251.175.103:https > 172.24.99.60:44880 / Raw
2024-03-08 22:00:45.854229 - Ether / IP / UDP 172.24.99.60:44880 > 142.251.175.103:https / Raw
2024-03-08 22:00:45.855683 - Ether / IP / UDP 142.251.175.103:https > 172.24.99.60:44880 / Raw
2024-03-08 22:00:45.857510 - Ether / IP / UDP 142.251.175.103:https > 172.24.99.60:44880 / Raw
2024-03-08 22:00:45.861548 - Ether / IP / UDP 172.24.99.60:44880 > 142.251.175.103:https / Raw
2024-03-08 22:00:45.863050 - Ether / IP / UDP 172.24.99.60:44880 > 142.251.175.103:https / Raw
2024-03-08 22:00:45.867667 - Ether / IP / UDP 142.251.175.103:https > 172.24.99.60:44880 / Raw
2024-03-08 22:00:45.869431 - Ether / IP / UDP 142.251.175.103:https > 172.24.99.60:44880 / Raw
2024-03-08 22:00:45.870534 - Ether / IP / UDP 142.251.175.103:https > 172.24.99.60:44880 / Raw
2024-03-08 22:00:45.871999 - Ether / IP / UDP 172.24.99.60:44880 > 142.251.175.103:https / Raw
2024-03-08 22:00:45.873720 - Ether / IP / UDP 142.251.175.103:https > 172.24.99.60:44880 / Raw
2024-03-08 22:00:45.875211 - Ether / IP / UDP 142.251.175.103:https > 172.24.99.60:44880 / Raw
2024-03-08 22:00:45.876451 - Ether / IP / UDP 142.251.175.103:https > 172.24.99.60:44880 / Raw
2024-03-08 22:00:45.877666 - Ether / IP / UDP 172.24.99.60:44880 > 142.251.175.103:https / Raw
2024-03-08 22:00:45.891422 - Ether / IP / UDP 142.251.175.103:https > 172.24.99.60:44880 / Raw
2024-03-08 22:00:45.911930 - Ether / IP / UDP 172.24.99.60:44880 > 142.251.175.103:https / Raw
2024-03-08 22:00:45.916716 - Ether / IP / UDP 142.251.175.103:https > 172.24.99.60:44880 / Raw
2024-03-08 22:00:45.961028 - Ether / IP / UDP 142.251.175.103:https > 172.24.99.60:44880 / Raw
2024-03-08 22:00:45.963209 - Ether / IP / UDP 172.24.99.60:44880 > 142.251.175.103:https / Raw
2024-03-08 22:00:45.966657 - Ether / IP / UDP 142.251.175.103:https > 172.24.99.60:44880 / Raw
2024-03-08 22:00:45.969010 - Ether / IP / UDP 142.251.175.103:https > 172.24.99.60:44880 / Raw
2024-03-08 22:00:45.970654 - Ether / IP / UDP 172.24.99.60:44880 > 142.251.175.103:https / Raw
2024-03-08 22:00:45.971830 - Ether / IP / UDP 142.251.175.103:https > 172.24.99.60:44880 / Raw
2024-03-08 22:00:45.973640 - Ether / IP / UDP 142.251.175.103:https > 172.24.99.60:44880 / Raw
2024-03-08 22:00:45.975345 - Ether / IP / UDP 142.251.175.103:https > 172.24.99.60:44880 / Raw
2024-03-08 22:00:45.977560 - Ether / IP / UDP 172.24.99.60:44880 > 142.251.175.103:https / Raw
2024-03-08 22:00:45.980095 - Ether / IP / UDP 142.251.175.103:https > 172.24.99.60:44880 / Raw
2024-03-08 22:00:45.982113 - Ether / IP / UDP 142.251.175.103:https > 172.24.99.60:44880 / Raw
2024-03-08 22:00:45.985291 - Ether / IP / UDP 142.251.175.103:https > 172.24.99.60:44880 / Raw
2024-03-08 22:00:45.989272 - Ether / IP / UDP 172.24.99.60:44880 > 142.251.175.103:https / Raw
2024-03-08 22:00:46.016344 - Ether / IP / UDP 142.251.175.103:https > 172.24.99.60:44880 / Raw
2024-03-08 22:00:46.045401 - Ether / IP / UDP 172.24.99.60:44880 > 142.251.175.103:https / Raw
2024-03-08 22:00:46.054573 - Ether / IP / UDP 172.24.99.60:44880 > 142.251.175.103:https / Raw
2024-03-08 22:00:46.056214 - Ether / IP / UDP 172.24.99.60:44880 > 142.251.175.103:https / Raw
2024-03-08 22:00:46.070215 - Ether / IP / UDP 142.251.175.103:https > 172.24.99.60:44880 / Raw
2024-03-08 22:00:46.076258 - Ether / IP / UDP 142.251.175.103:https > 172.24.99.60:44880 / Raw
2024-03-08 22:00:46.077972 - Ether / IP / UDP 142.251.175.103:https > 172.24.99.60:44880 / Raw
2024-03-08 22:00:46.080185 - Ether / IP / UDP 172.24.99.60:44880 > 142.251.175.103:https / Raw
2024-03-08 22:00:46.081911 - Ether / IP / UDP 142.251.175.103:https > 172.24.99.60:44880 / Raw
2024-03-08 22:00:46.083803 - Ether / IP / UDP 142.251.175.103:https > 172.24.99.60:44880 / Raw
2024-03-08 22:00:46.085477 - Ether / IP / UDP 142.251.175.103:https > 172.24.99.60:44880 / Raw
2024-03-08 22:00:46.087500 - Ether / IP / UDP 142.251.175.103:https > 172.24.99.60:44880 / Raw
2024-03-08 22:00:46.089538 - Ether / IP / UDP 142.251.175.103:https > 172.24.99.60:44880 / Raw
2024-03-08 22:00:46.091340 - Ether / IP / UDP 142.251.175.103:https > 172.24.99.60:44880 / Raw
2024-03-08 22:00:46.092734 - Ether / IP / UDP 172.24.99.60:44880 > 142.251.175.103:https / Raw
2024-03-08 22:00:46.114054 - Ether / IP / UDP 142.251.175.103:https > 172.24.99.60:44880 / Raw
2024-03-08 22:00:46.131078 - Ether / IP / UDP 172.24.96.1:57621 > 172.24.111.255:57621 / Raw
2024-03-08 22:00:46.147027 - Ether / IP / UDP 172.24.99.60:54999 > 64.233.170.154:https / Raw
2024-03-08 22:00:46.149504 - Ether / IP / UDP 172.24.99.60:54999 > 64.233.170.154:https / Raw
2024-03-08 22:00:46.168586 - Ether / IP / UDP 64.233.170.154:https > 172.24.99.60:54999 / Raw
2024-03-08 22:00:46.171606 - Ether / IP / UDP 64.233.170.154:https > 172.24.99.60:54999 / Raw
2024-03-08 22:00:46.173213 - Ether / IP / UDP 172.24.99.60:54999 > 64.233.170.154:https / Raw
2024-03-08 22:00:46.750728 - Ether / IP / UDP 172.24.99.60:44880 > 142.251.175.103:https / Raw
2024-03-08 22:00:46.777404 - Ether / IP / UDP 142.251.175.103:https > 172.24.99.60:44880 / Raw
2024-03-08 22:00:46.799221 - Ether / IP / UDP 172.24.99.60:44880 > 142.251.175.103:https / Raw
2024-03-08 22:00:46.879298 - Ether / IP / UDP 142.251.175.103:https > 172.24.99.60:44880 / Raw
2024-03-08 22:00:46.880816 - Ether / IP / UDP 142.251.175.103:https > 172.24.99.60:44880 / Raw
2024-03-08 22:00:46.882278 - Ether / IP / UDP 172.24.99.60:44880 > 142.251.175.103:https / Raw
2024-03-08 22:00:46.883967 - Ether / IP / UDP 142.251.175.103:https > 172.24.99.60:44880 / Raw
2024-03-08 22:00:46.886429 - Ether / IP / UDP 142.251.175.103:https > 172.24.99.60:44880 / Raw
2024-03-08 22:00:46.889246 - Ether / IP / UDP 142.251.175.103:https > 172.24.99.60:44880 / Raw
2024-03-08 22:00:46.891241 - Ether / IP / UDP 142.251.175.103:https > 172.24.99.60:44880 / Raw
2024-03-08 22:00:46.893619 - Ether / IP / UDP 142.251.175.103:https > 172.24.99.60:44880 / Raw
2024-03-08 22:00:46.896519 - Ether / IP / UDP 142.251.175.103:https > 172.24.99.60:44880 / Raw
2024-03-08 22:00:46.898639 - Ether / IP / UDP 142.251.175.103:https > 172.24.99.60:44880 / Raw
2024-03-08 22:00:46.901322 - Ether / IP / UDP 172.24.99.60:44880 > 142.251.175.103:https / Raw
2024-03-08 22:00:46.905188 - Ether / IP / UDP 142.251.175.103:https > 172.24.99.60:44880 / Raw
2024-03-08 22:00:46.908113 - Ether / IP / UDP 142.251.175.103:https > 172.24.99.60:44880 / Raw
2024-03-08 22:00:46.910215 - Ether / IP / UDP 142.251.175.103:https > 172.24.99.60:44880 / Raw
2024-03-08 22:00:46.911569 - Ether / IP / UDP 142.251.175.103:https > 172.24.99.60:44880 / Raw
2024-03-08 22:00:46.913097 - Ether / IP / UDP 142.251.175.103:https > 172.24.99.60:44880 / Raw
2024-03-08 22:00:46.914940 - Ether / IP / UDP 172.24.99.60:44880 > 142.251.175.103:https / Raw
2024-03-08 22:00:46.916666 - Ether / IP / UDP 142.251.175.103:https > 172.24.99.60:44880 / Raw
2024-03-08 22:00:46.918276 - Ether / IP / UDP 142.251.175.103:https > 172.24.99.60:44880 / Raw
2024-03-08 22:00:46.920381 - Ether / IP / UDP 142.251.175.103:https > 172.24.99.60:44880 / Raw
2024-03-08 22:00:46.922716 - Ether / IP / UDP 142.251.175.103:https > 172.24.99.60:44880 / Raw
2024-03-08 22:00:46.924747 - Ether / IP / UDP 142.251.175.103:https > 172.24.99.60:44880 / Raw
2024-03-08 22:00:46.926578 - Ether / IP / UDP 142.251.175.103:https > 172.24.99.60:44880 / Raw
2024-03-08 22:00:46.928476 - Ether / IP / UDP 172.24.99.60:44880 > 142.251.175.103:https / Raw
2024-03-08 22:00:46.930584 - Ether / IP / UDP 142.251.175.103:https > 172.24.99.60:44880 / Raw
2024-03-08 22:00:46.933673 - Ether / IP / UDP 142.251.175.103:https > 172.24.99.60:44880 / Raw
2024-03-08 22:00:46.936053 - Ether / IP / UDP 172.24.99.60:44880 > 142.251.175.103:https / Raw
2024-03-08 22:00:46.938022 - Ether / IP / UDP 142.251.175.103:https > 172.24.99.60:44880 / Raw
2024-03-08 22:00:46.940089 - Ether / IP / UDP 142.251.175.103:https > 172.24.99.60:44880 / Raw
2024-03-08 22:00:46.941897 - Ether / IP / UDP 142.251.175.103:https > 172.24.99.60:44880 / Raw
2024-03-08 22:00:46.943756 - Ether / IP / UDP 142.251.175.103:https > 172.24.99.60:44880 / Raw
2024-03-08 22:00:46.945166 - Ether / IP / UDP 142.251.175.103:https > 172.24.99.60:44880 / Raw
2024-03-08 22:00:46.946562 - Ether / IP / UDP 142.251.175.103:https > 172.24.99.60:44880 / Raw
2024-03-08 22:00:46.947819 - Ether / IP / UDP 142.251.175.103:https > 172.24.99.60:44880 / Raw
2024-03-08 22:00:46.949416 - Ether / IP / UDP 142.251.175.103:https > 172.24.99.60:44880 / Raw
2024-03-08 22:00:46.951128 - Ether / IP / UDP 142.251.175.103:https > 172.24.99.60:44880 / Raw
2024-03-08 22:00:46.952743 - Ether / IP / UDP 142.251.175.103:https > 172.24.99.60:44880 / Raw
2024-03-08 22:00:46.954150 - Ether / IP / UDP 142.251.175.103:https > 172.24.99.60:44880 / Raw
2024-03-08 22:00:46.955810 - Ether / IP / UDP 142.251.175.103:https > 172.24.99.60:44880 / Raw
2024-03-08 22:00:46.957144 - Ether / IP / UDP 142.251.175.103:https > 172.24.99.60:44880 / Raw
2024-03-08 22:00:46.958782 - Ether / IP / UDP 142.251.175.103:https > 172.24.99.60:44880 / Raw
2024-03-08 22:00:46.960165 - Ether / IP / UDP 172.24.99.60:44880 > 142.251.175.103:https / Raw
2024-03-08 22:00:46.961646 - Ether / IP / UDP 142.251.175.103:https > 172.24.99.60:44880 / Raw
2024-03-08 22:00:46.962959 - Ether / IP / UDP 142.251.175.103:https > 172.24.99.60:44880 / Raw
2024-03-08 22:00:46.964784 - Ether / IP / UDP 172.24.99.60:44880 > 142.251.175.103:https / Raw
2024-03-08 22:00:46.966333 - Ether / IP / UDP 142.251.175.103:https > 172.24.99.60:44880 / Raw
2024-03-08 22:00:46.968304 - Ether / IP / UDP 142.251.175.103:https > 172.24.99.60:44880 / Raw
2024-03-08 22:00:46.970191 - Ether / IP / UDP 172.24.99.60:44880 > 142.251.175.103:https / Raw
2024-03-08 22:00:46.971684 - Ether / IP / UDP 142.251.175.103:https > 172.24.99.60:44880 / Raw
2024-03-08 22:00:46.974004 - Ether / IP / UDP 142.251.175.103:https > 172.24.99.60:44880 / Raw
2024-03-08 22:00:46.975798 - Ether / IP / UDP 142.251.175.103:https > 172.24.99.60:44880 / Raw
2024-03-08 22:00:46.977581 - Ether / IP / UDP 172.24.99.60:44880 > 142.251.175.103:https / Raw
2024-03-08 22:00:46.979253 - Ether / IP / UDP 142.251.175.103:https > 172.24.99.60:44880 / Raw
2024-03-08 22:00:46.992276 - Ether / IP / UDP 172.24.99.60:44880 > 142.251.175.103:https / Raw
2024-03-08 22:00:47.015055 - Ether / IP / UDP 172.24.99.60:44880 > 142.251.175.103:https / Raw
2024-03-08 22:00:47.017030 - Ether / IP / UDP 142.251.175.103:https > 172.24.99.60:44880 / Raw
2024-03-08 22:00:47.019973 - Ether / IP / UDP 142.251.175.103:https > 172.24.99.60:44880 / Raw
2024-03-08 22:00:47.021632 - Ether / IP / UDP 172.24.99.60:44880 > 142.251.175.103:https / Raw
2024-03-08 22:00:47.024106 - Ether / IP / UDP 142.251.175.103:https > 172.24.99.60:44880 / Raw
2024-03-08 22:00:47.036417 - Ether / IP / UDP 142.251.175.103:https > 172.24.99.60:44880 / Raw
2024-03-08 22:00:47.038276 - Ether / IP / UDP 172.24.99.60:44880 > 142.251.175.103:https / Raw
2024-03-08 22:00:47.040585 - Ether / IP / UDP 142.251.175.103:https > 172.24.99.60:44880 / Raw
2024-03-08 22:00:47.042270 - Ether / IP / UDP 142.251.175.103:https > 172.24.99.60:44880 / Raw
2024-03-08 22:00:47.044267 - Ether / IP / UDP 172.24.99.60:44880 > 142.251.175.103:https / Raw
2024-03-08 22:00:47.054492 - Ether / IP / UDP 142.251.175.103:https > 172.24.99.60:44880 / Raw
2024-03-08 22:00:47.076394 - Ether / IP / UDP 142.251.175.103:https > 172.24.99.60:44880 / Raw
2024-03-08 22:00:47.091919 - Ether / IP / UDP 172.24.99.60:44880 > 142.251.175.103:https / Raw
2024-03-08 22:00:47.119597 - Ether / IP / UDP 142.251.175.103:https > 172.24.99.60:44880 / Raw
2024-03-08 22:00:47.124148 - Ether / IP / UDP 142.251.175.103:https > 172.24.99.60:44880 / Raw
2024-03-08 22:00:47.125654 - Ether / IP / UDP 142.251.175.103:https > 172.24.99.60:44880 / Raw
2024-03-08 22:00:47.127406 - Ether / IP / UDP 172.24.99.60:44880 > 142.251.175.103:https / Raw
2024-03-08 22:00:47.134886 - Ether / IPv6 / UDP / DNS Qry "b'_ftp._tcp.local.'" 
2024-03-08 22:00:47.136838 - Ether / IP / UDP / DNS Qry "b'_ftp._tcp.local.'" 
2024-03-08 22:00:47.156155 - Ether / IP / UDP 142.251.175.103:https > 172.24.99.60:44880 / Raw
2024-03-08 22:00:47.178566 - Ether / IP / UDP 172.24.99.60:44880 > 142.251.175.103:https / Raw
2024-03-08 22:00:47.204888 - Ether / IP / UDP 142.251.175.103:https > 172.24.99.60:44880 / Raw
2024-03-08 22:00:47.215441 - Ether / IP / UDP 172.24.99.60:44880 > 142.251.175.103:https / Raw
2024-03-08 22:00:47.225680 - Ether / IP / UDP 172.24.99.60:44880 > 142.251.175.103:https / Raw
2024-03-08 22:00:47.238197 - Ether / IP / UDP 142.251.175.103:https > 172.24.99.60:44880 / Raw
2024-03-08 22:00:47.246196 - Ether / IP / UDP 142.251.175.103:https > 172.24.99.60:44880 / Raw
2024-03-08 22:00:47.248010 - Ether / IP / UDP 142.251.175.103:https > 172.24.99.60:44880 / Raw
2024-03-08 22:00:47.250098 - Ether / IP / UDP 172.24.99.60:44880 > 142.251.175.103:https / Raw
2024-03-08 22:00:47.261659 - Ether / IP / UDP 142.251.175.103:https > 172.24.99.60:44880 / Raw
2024-03-08 22:00:47.263766 - Ether / IP / UDP 142.251.175.103:https > 172.24.99.60:44880 / Raw
2024-03-08 22:00:47.266219 - Ether / IP / UDP 142.251.175.103:https > 172.24.99.60:44880 / Raw
2024-03-08 22:00:47.267809 - Ether / IP / UDP 172.24.99.60:44880 > 142.251.175.103:https / Raw
2024-03-08 22:00:47.269228 - Ether / IP / UDP 142.251.175.103:https > 172.24.99.60:44880 / Raw
2024-03-08 22:00:47.270757 - Ether / IP / UDP 142.251.175.103:https > 172.24.99.60:44880 / Raw
2024-03-08 22:00:47.272447 - Ether / IP / UDP 172.24.99.60:44880 > 142.251.175.103:https / Raw
2024-03-08 22:00:47.275378 - Ether / IP / UDP 142.251.175.103:https > 172.24.99.60:44880 / Raw
2024-03-08 22:00:47.291358 - Ether / IP / UDP 142.251.175.103:https > 172.24.99.60:44880 / Raw
2024-03-08 22:00:47.340604 - Ether / IP / UDP 172.24.99.60:44880 > 142.251.175.103:https / Raw
2024-03-08 22:00:47.342278 - Ether / IP / UDP 172.24.99.60:44880 > 142.251.175.103:https / Raw
2024-03-08 22:00:47.368984 - Ether / IP / UDP 142.251.175.103:https > 172.24.99.60:44880 / Raw
2024-03-08 22:00:47.370961 - Ether / IP / UDP 142.251.175.103:https > 172.24.99.60:44880 / Raw
2024-03-08 22:00:47.372895 - Ether / IP / UDP 142.251.175.103:https > 172.24.99.60:44880 / Raw
2024-03-08 22:00:47.374401 - Ether / IP / UDP 142.251.175.103:https > 172.24.99.60:44880 / Raw
2024-03-08 22:00:47.376071 - Ether / IP / UDP 142.251.175.103:https > 172.24.99.60:44880 / Raw
2024-03-08 22:00:47.377786 - Ether / IP / UDP 142.251.175.103:https > 172.24.99.60:44880 / Raw
2024-03-08 22:00:47.379273 - Ether / IP / UDP 172.24.99.60:44880 > 142.251.175.103:https / Raw
2024-03-08 22:00:47.396264 - Ether / IP / UDP 142.251.175.103:https > 172.24.99.60:44880 / Raw
2024-03-08 22:00:47.418625 - Ether / IP / UDP 172.24.99.60:44880 > 142.251.175.103:https / Raw
2024-03-08 22:00:47.429131 - Ether / IP / UDP 172.24.99.60:44880 > 142.251.175.103:https / Raw
2024-03-08 22:00:47.440513 - Ether / IP / UDP 142.251.175.103:https > 172.24.99.60:44880 / Raw
2024-03-08 22:00:47.451294 - Ether / IP / UDP 142.251.175.103:https > 172.24.99.60:44880 / Raw
2024-03-08 22:00:47.453255 - Ether / IP / UDP 172.24.99.60:44880 > 142.251.175.103:https / Raw
2024-03-08 22:00:47.455435 - Ether / IP / UDP 142.251.175.103:https > 172.24.99.60:44880 / Raw
2024-03-08 22:00:47.456972 - Ether / IP / UDP 142.251.175.103:https > 172.24.99.60:44880 / Raw
2024-03-08 22:00:47.458970 - Ether / IP / UDP 142.251.175.103:https > 172.24.99.60:44880 / Raw
2024-03-08 22:00:47.460650 - Ether / IP / UDP 142.251.175.103:https > 172.24.99.60:44880 / Raw
2024-03-08 22:00:47.462418 - Ether / IP / UDP 142.251.175.103:https > 172.24.99.60:44880 / Raw
2024-03-08 22:00:47.464137 - Ether / IP / UDP 142.251.175.103:https > 172.24.99.60:44880 / Raw
2024-03-08 22:00:47.466225 - Ether / IP / UDP 172.24.99.60:44880 > 142.251.175.103:https / Raw
2024-03-08 22:00:47.468127 - Ether / IP / UDP 142.251.175.103:https > 172.24.99.60:44880 / Raw
2024-03-08 22:00:47.470106 - Ether / IP / UDP 172.24.99.60:44880 > 142.251.175.103:https / Raw
2024-03-08 22:00:47.489435 - Ether / IP / UDP 142.251.175.103:https > 172.24.99.60:44880 / Raw
2024-03-08 22:00:47.500715 - Ether / IP / UDP 172.24.99.60:44880 > 142.251.175.103:https / Raw
2024-03-08 22:00:47.523042 - Ether / IP / UDP 142.251.175.103:https > 172.24.99.60:44880 / Raw
2024-03-08 22:00:47.528520 - Ether / IP / UDP 142.251.175.103:https > 172.24.99.60:44880 / Raw
2024-03-08 22:00:47.529996 - Ether / IP / UDP 172.24.99.60:44880 > 142.251.175.103:https / Raw
2024-03-08 22:00:47.531983 - Ether / IP / UDP 142.251.175.103:https > 172.24.99.60:44880 / Raw
2024-03-08 22:00:47.540944 - Ether / IP / UDP 172.24.99.60:44880 > 142.251.175.103:https / Raw
2024-03-08 22:00:47.551196 - Ether / IP / UDP 172.24.99.60:44880 > 142.251.175.103:https / Raw
2024-03-08 22:00:47.557910 - Ether / IP / UDP 142.251.175.103:https > 172.24.99.60:44880 / Raw
2024-03-08 22:00:47.564482 - Ether / IP / UDP 142.251.175.103:https > 172.24.99.60:44880 / Raw
2024-03-08 22:00:47.570219 - Ether / IP / UDP 142.251.175.103:https > 172.24.99.60:44880 / Raw
2024-03-08 22:00:47.572337 - Ether / IP / UDP 142.251.175.103:https > 172.24.99.60:44880 / Raw
2024-03-08 22:00:47.574848 - Ether / IP / UDP 172.24.99.60:44880 > 142.251.175.103:https / Raw
2024-03-08 22:00:47.614340 - Ether / IP / UDP 142.251.175.103:https > 172.24.99.60:44880 / Raw
